l_id,company,title,location,level,posted,url,description,yoe,arrangement,pay
4141908332,Nexium Tech,Full Stack Engineer,United States,Entry level,2025-02-04 08:22:11,https://www.linkedin.com/jobs/view/full-stack-engineer-at-nexium-tech-4141908332?trk=public_jobs_topcard-title,"['\n', <strong>Job Description</strong>, <p>This is a remote position.</p>, <p>We are seeking a highly motivated and skilled Full Stack Developer to join our growing team. As a Full Stack Developer, you will be responsible for designing, developing, and maintaining web applications. You will work closely with other developers, designers, and product managers to deliver high-quality software solutions. This role requires a strong understanding of both front-end and back-end technologies, as well as a passion for creating user-friendly and efficient applications.   </p>, <p><br/></p>, <p><strong>Responsibilities:</strong></p>, <ul><li>Develop and maintain front-end and back-end components of web applications.</li><li>Write clean, efficient, and well-documented code.</li><li>Participate in code reviews and contribute to improving code quality.</li><li>Collaborate with designers to implement user interfaces and user experiences.</li><li>Work with product managers to understand requirements and translate them into technical specifications.</li><li>Troubleshoot and debug issues in existing applications.   </li><li>Stay up-to-date with the latest technologies and trends in web development.</li><li>Contribute to the overall architecture and design of our applications.</li><li>Participate in agile development processes.</li><li>Deploy and maintain applications on cloud platforms.</li></ul>, <p><strong>Qualifications:</strong></p>, <ul><li>Bachelor's degree in Computer Science or a related field, or equivalent practical experience.</li><li>Proven experience as a Full Stack Developer.</li><li>Strong understanding of front-end technologies such as HTML, CSS, and JavaScript.</li><li>Experience with modern JavaScript frameworks such as React, Angular, or Vue.js.</li><li>Proficiency in back-end technologies such as Node.js, Python, Java, or Ruby on Rails.</li><li>Experience with database systems such as MySQL, PostgreSQL, or MongoDB.</li><li>Familiarity with cloud platforms such as AWS, Azure, or Google Cloud.</li><li>Understanding of version control systems such as Git.</li><li>Excellent problem-solving and analytical skills.</li></ul>, <p><br/></p>, '\n']",2,Remote,Pay not stated
4142229177,"The Marlin Alliance, Inc.",Junior Power BI Developer,United States,Entry level,2025-02-04 08:22:12,https://www.linkedin.com/jobs/view/junior-power-bi-developer-at-the-marlin-alliance-inc-4142229177?trk=public_jobs_topcard-title,"['\n', <p>The Marlin Alliance is seeking an enthusiastic <strong>Junior Power BI Developer</strong> to join our team supporting Navy clients. In this role, you will work closely with mid-level and senior developers to design and deliver data visualizations, dashboards, and reports, leveraging Microsoft Power BI and Dataverse. This is a fully remote position, but applicants must have the ability to obtain a DoD Secret Clearance.</p>, <p><br/></p>, <p><strong>Responsibilities:</strong></p>, <ul><li>Assist in developing Power BI dashboards, reports, and data visualizations to meet client requirements.</li><li>Collaborate with team members to connect, transform, and model data from Dataverse and other data sources.</li><li>Learn and apply best practices for Power BI development, including performance optimization and user-friendly design.</li><li>Support testing, debugging, and maintenance of Power BI solutions.</li><li>Participate in meetings with clients to gather requirements and present progress.</li><li>Document development processes and solutions to ensure knowledge sharing and maintainability.</li></ul>, <p><br/></p>, <p><strong>Required Qualifications:</strong></p>, <ul><li>Active or ability to obtain a <strong>DoD Secret Clearance</strong>.</li><li>Bachelor’s degree in Computer Science, Information Systems, or related field, or 1+ year of relevant experience.</li><li>Basic knowledge of Microsoft Power BI, including building reports and dashboards.</li><li>Familiarity with data models, relationships, and Dataverse.</li><li>Strong analytical and problem-solving skills.</li><li>Excellent written and verbal communication skills.</li></ul>, <p><br/></p>, <p><strong>Preferred Skills:</strong></p>, <ul><li>Exposure to Power Platform tools like Power Apps or Power Automate.</li><li>Basic understanding of SQL for querying and manipulating data.</li><li>Relevant Microsoft certifications such as PL-900.</li></ul>, <p><br/></p>, <p><strong>Salary Range:</strong></p>, <p>$70,000–$95,000 annually</p>, <p><br/></p>, <p><strong>Work Environment and Mental/Physical Demands</strong></p>, <p><em>The physical demands described here are representative of those that must be met by an employee to successfully perform the essential functions of this position. Reasonable accommodations may be made to enable individuals with disabilities to perform the functions, absent undue hardships.</em></p>, <ul><li>Must be able to perform work in a stationary position at a minimum of 50% of the time.</li><li>Must have the ability to operate computer and other office productivity machinery consistently during work hours.</li><li>Must have the ability to communicate and exchange information and ideas in an in-person or virtual setting through the use of online tools and available communication mediums.</li><li>Reasonable accommodations may be made to enable individuals with disabilities to perform essential functions of their job, absent undue hardship.</li></ul>, <p>The Employer retains the right to change or assign other duties to this position as deemed necessary</p>, <p><br/></p>, <p><strong>Job Classification:</strong></p>, <p>Associate I</p>, <p>$70K - $110K</p>, <p><br/></p>, <p><strong><em>Disclaimer:</em></strong></p>, <p><em>This job description in no way states or implies that these are the only duties to be performed by the employee(s) incumbent in this position. Employees will be required to follow any other job-related instructions and to perform any other job-related duties requested by any person authorized to give instructions or assignments. All duties and responsibilities are essential functions and requirements and are subject to possible modification to reasonably accommodate individuals with disabilities.</em></p>, <p><em>To perform this job successfully, the incumbents will possess the skills, aptitudes, and abilities to perform each duty proficiently. Some requirements may exclude individuals who pose a direct threat or significant risk to the health or safety of themselves or others. The requirements listed in this document are the minimum levels of knowledge, skills, or abilities.</em></p>, <p><em>This document does not create an employment contract, implied or otherwise, other than an “at-will” relationship.</em></p>, <p><em>An Equal Opportunity Employer/Protected Veterans/Individuals with Disabilities</em>.</p>, '\n']",0,Remote,"$70,000–$95,000"
4142603050,Z-Score Health,Software Engineer Intern,United States,Internship,2025-02-04 08:22:12,https://www.linkedin.com/jobs/view/software-engineer-intern-at-z-score-health-4142603050?trk=public_jobs_topcard-title,"['\n', <p>Join Our Innovative Team at Z-score Health!</p>, <p><br/></p>, <p>Location: Atlanta, Georgia</p>, <p><br/></p>, <p>About Z-score Health:</p>, <p>Z-score Health is a forward-thinking health tech startup revolutionizing patient care with AI-powered health assessments. Our innovative approach leverages user data to build advanced risk models, uncovering hidden insights that empower healthcare providers with more effective diagnosis tools.</p>, <p><br/></p>, <p>We Are Looking For:</p>, <p>Passionate and skilled professionals who are excited about the intersection of healthcare and technology. If you have a background in any of the following areas, we encourage you to apply:</p>, <p><br/></p>, <p> • Artificial Intelligence and Machine Learning</p>, <p> • Data Analysis and Biostatistics</p>, <p> • Software Development (Various Levels)</p>, <p> • Health Informatics and Data Management</p>, <p> • Product Development and Management</p>, <p> • Marketing and Business Development</p>, <p> • Human Resources and Administrative Support</p>, <p> • Customer Support and Client Relations</p>, <p> • Clinical Research and Healthcare Consulting</p>, <p> • Regulatory Affairs and Compliance</p>, <p><br/></p>, <p>Key Qualifications:</p>, <p><br/></p>, <p> • Relevant experience in your field</p>, <p> • Strong analytical and problem-solving skills</p>, <p> • Excellent communication and teamwork abilities</p>, <p> • Commitment to improving healthcare through technology</p>, <p><br/></p>, <p>What We Offer:</p>, <p><br/></p>, <p> • A dynamic and inclusive work environment</p>, <p> • Opportunities for professional growth and development</p>, <p> • Competitive salary and benefits package</p>, <p> • Collaborative culture that values innovation and creativity</p>, <p><br/></p>, <p>How to Apply:</p>, <p>Please submit your resume along with a cover letter explaining your interest in Z-score Health and how your skills and experience align with our mission.</p>, <p><br/></p>, <p>Z-score Health is an equal opportunity employer. We celebrate diversity and are committed to creating an inclusive environment for all employees.</p>, '\n']",0,On-site,Pay not stated
4140686836,Get It - Educational Services,Remote Associate Developer eLearning | WFH,"Myrtle Point, OR",Entry level,2025-02-04 08:22:12,https://www.linkedin.com/jobs/view/remote-associate-developer-elearning-wfh-at-get-it-educational-services-4140686836?trk=public_jobs_topcard-title,"['\n', <strong>Job Overview<br/><br/></strong>, 'Join a leading provider of integrated information, education, training, and consulting services dedicated to enhancing success in healthcare regulation and compliance. Our mission focuses on driving efficiency, improving patient care, and aiding healthcare organizations in navigating complex challenges through innovative educational solutions. We are currently seeking a motivated and inventive Associate eLearning Developer to become a vital member of our dynamic eLearning Production team.', <br/>, <br/>, <strong>Key Responsibilities<br/><br/></strong>, 'As an Associate eLearning Developer, you will be responsible for:', <br/>, <br/>, <ul><li>Developing eLearning courses using tools such as Adobe Audition and Articulate Storyline to ensure a cohesive and engaging learning experience.</li><li>Collaborating with voice-over talent, content development teams, and external subject matter experts (SMEs) to deliver content in a timely manner that meets project objectives.</li><li>Conducting quality assurance to guarantee courses meet both technical and content requirements, swiftly addressing any issues that arise.</li><li>Troubleshooting minor technical or design challenges and communicating these effectively, along with solutions, to enhance processes.</li><li>Managing your time efficiently to balance multiple projects and adapt to changing priorities in a fast-paced environment.</li><li>Supporting the team with various tasks and initiatives to contribute to ongoing educational projects.<br/><br/></li></ul>, <strong>Required Skills<br/><br/></strong>, 'We are looking for candidates with the following skills:', <br/>, <br/>, <ul><li>Proficiency in Microsoft Office Suite, especially PowerPoint.</li><li>A strong desire to learn and excel in the digital media arena.</li><li>Familiarity with Articulate 360 and experience with audio editing software such as WavePad, Audacity, or Adobe Audition is an advantage.</li><li>Excellent verbal and written communication abilities.</li><li>Robust technical skills with a knack for independently troubleshooting and resolving technology or content-related issues.</li><li>Strong organizational and time management capabilities to effectively handle multiple tasks and shifting deadlines.<br/><br/></li></ul>, <strong>Qualifications<br/><br/></strong>, <ul><li>A Bachelor's degree in a relevant field.</li><li>0-1 year of experience in eLearning development, digital content creation, or a similar role.<br/><br/></li></ul>, <strong>Career Growth Opportunities<br/><br/></strong>, 'At our organization, you will have the opportunity for professional growth and development. We are committed to supporting your learning journey and career advancement by providing avenues to explore the digital media sphere and enhance your eLearning development skills.', <br/>, <br/>, <strong>Company Culture And Values<br/><br/></strong>, 'Join a passionate team that values creativity and collaboration. You will be part of a culture that fosters innovation and encourages contributions that directly influence the effectiveness of educational initiatives in the healthcare sector.', <br/>, <br/>, 'If you are excited about the prospect of shaping the future of eLearning and education in healthcare, we invite you to apply!', <br/>, <br/>, 'Employment Type: Full-Time\n        ']",0,Remote,Pay not stated
4141911267,Lunova Tech,Software Engineer,United States,Entry level,2025-02-04 08:22:13,https://www.linkedin.com/jobs/view/software-engineer-at-lunova-tech-4141911267?trk=public_jobs_topcard-title,"['\n', <p>The ideal candidate will be responsible for developing high-quality applications. They will also be responsible for designing and implementing testable and scalable code. </p>, <p><br/></p>, <p><strong>🔹 Job Title:</strong> Software Engineer</p>, <p><strong>📍 Location:</strong> United States (Remote)</p>, <p><strong>💰 Salary:</strong> $110k - $140k Annually</p>, <p><strong>📌 Job Type:</strong> Full-Time</p>, <p><br/></p>, <p><span>We are looking for a Software Engineer to join our dynamic team! This is a fully remote role based in the U.S. You'll be working on innovative projects, collaborating with cross-functional teams, and contributing to cutting-edge solutions.</span></p>, <p><br/></p>, <p><strong>Responsibilities</strong></p>, <ul><li>Develop quality software and web applications</li><li>Analyze and maintain existing software applications</li><li>Design highly scalable, testable code</li><li>Discover and fix programming bugs</li></ul>, <p><br/></p>, <p><strong>Qualifications</strong></p>, <ul><li>Bachelor's degree or equivalent experience in Computer Science or related field</li><li>Development experience with programming languages</li><li>SQL database or relational database skills</li></ul>, '\n']",4,Remote,$110k-$140k
4141113979,Z-Score Health,Software Engineer Intern,"Atlanta, GA",Internship,2025-02-04 08:22:13,https://www.linkedin.com/jobs/view/software-engineer-intern-at-z-score-health-4141113979?trk=public_jobs_topcard-title,"['\n', <p>Join Our Innovative Team at Z-score Health!</p>, <p><br/></p>, <p>Location: Atlanta, GA</p>, <p><br/></p>, <p>About Z-score Health:</p>, <p>Z-score Health is a forward-thinking health tech startup revolutionizing patient care with AI-powered health assessments. Our innovative approach leverages user data to build advanced risk models, uncovering hidden insights that empower healthcare providers with more effective diagnosis tools.</p>, <p><br/></p>, <p>We Are Looking For:</p>, <p>Passionate and skilled professionals who are excited about the intersection of healthcare and technology. If you have a background in any of the following areas, we encourage you to apply:</p>, <p><br/></p>, <p>• Artificial Intelligence and Machine Learning</p>, <p>• Data Analysis and Biostatistics</p>, <p>• Software Development (Various Levels)</p>, <p>• Health Informatics and Data Management</p>, <p>• Product Development and Management</p>, <p>• Marketing and Business Development</p>, <p>• Human Resources and Administrative Support</p>, <p>• Customer Support and Client Relations</p>, <p>• Clinical Research and Healthcare Consulting</p>, <p>• Regulatory Affairs and Compliance</p>, <p><br/></p>, <p>Key Qualifications:</p>, <p><br/></p>, <p>• Relevant experience in your field</p>, <p>• Strong analytical and problem-solving skills</p>, <p>• Excellent communication and teamwork abilities</p>, <p>• Commitment to improving healthcare through technology</p>, <p><br/></p>, <p>What We Offer:</p>, <p><br/></p>, <p>• A dynamic and inclusive work environment</p>, <p>• Opportunities for professional growth and development</p>, <p>• Competitive salary and benefits package</p>, <p>• Collaborative culture that values innovation and creativity</p>, <p><br/></p>, <p>How to Apply:</p>, <p>Please submit your resume along with a cover letter explaining your interest in Z-score Health and how your skills and experience align with our mission.</p>, <p><br/></p>, <p>Z-score Health is an equal opportunity employer. We celebrate diversity and are committed to creating an inclusive environment for all employees.</p>, <p><br/></p>, <p><br/></p>, '\n']",0,On-site,Pay not stated
4142432557,Virexon Tech,Software Engineer,United States,Entry level,2025-02-04 08:22:13,https://www.linkedin.com/jobs/view/software-engineer-at-virexon-tech-4142432557?trk=public_jobs_topcard-title,"['\n', <strong>Job Description</strong>, <p>This is a remote position.</p>, <p>We are seeking a talented <strong>Software Engineer</strong> to design, develop, and maintain scalable software solutions. The ideal candidate will have strong problem-solving skills, experience in software development, and a passion for building efficient and reliable applications.</p>, <p><br/></p>, <strong>Key Responsibilities:</strong>, <ul><li>Design, develop, test, and deploy high-quality software solutions.</li><li>Collaborate with cross-functional teams to define and implement new features.</li><li>Write clean, maintainable, and efficient code following best practices.</li><li>Troubleshoot, debug, and enhance existing applications.</li><li>Conduct code reviews and provide constructive feedback.</li><li>Ensure software security, performance, and scalability.</li><li>Stay updated with the latest industry trends and technologies.</li></ul>, <p><br/></p>, <strong>Required Qualifications:</strong>, <ul><li>Bachelor's or Master's degree in Computer Science, Software Engineering, or a related field.</li><li>Proficiency in <strong>Python, Java, JavaScript, C++, or another programming language</strong>.</li><li>Experience with web frameworks such as <strong>Django, React, Angular, or Spring Boot</strong>.</li><li>Familiarity with database systems like <strong>PostgreSQL, MySQL, or MongoDB</strong>.</li><li>Knowledge of cloud platforms (AWS, GCP, or Azure) is a plus.</li><li>Strong analytical and problem-solving skills.</li><li>Excellent communication and teamwork abilities.</li></ul>, <p><br/></p>, <strong>Preferred Qualifications:</strong>, <ul><li>Experience with <strong>DevOps tools</strong> like Docker, Kubernetes, or CI/CD pipelines.</li><li>Knowledge of <strong>microservices architecture and RESTful APIs</strong>.</li><li>Experience with <strong>unit testing and test-driven development (TDD)</strong>.</li><li>Understanding of <strong>agile methodologies and software development lifecycle</strong>.</li></ul>, <p><br/></p>, '\n']",2,Remote,Pay not stated
4142496976,Joinrs US,[Full Remote] Software Engineer,United States,Entry level,2025-02-04 08:22:14,https://www.linkedin.com/jobs/view/full-remote-software-engineer-at-joinrs-us-4142496976?trk=public_jobs_topcard-title,"['\n', <p><strong>This position is in the team of Nike, a</strong> <strong>U.S. multinational company that manufactures footwear, apparel, and sports accessories. At Joinrs, we look for the best professional opportunities for Junior profiles and showcase them on our platform.</strong></p>, <p><br/></p>, <p><strong>The summary of the opportunity from <em>Joinrs</em> <em>AI</em>:</strong></p>, <p>NIKE, Inc. seeks a full-time Software Engineer with a Master's degree in a relevant field and experience in various technologies. The candidate will develop and test digital products, manage solutions, and provide on-call support. Telecommuting is available from most U.S. states. We offer accommodations for the interview process to ensure inclusivity.</p>, <p>--</p>, <p><br/></p>, <p><br/></p>, <p>Software Engineer - NIKE, Inc.</p>, <p><br/></p>, <ul><li> Beaverton, OR Develop, configure, and test programs, systems and solutions in order to meet defined digital product specifications and directions.</li></ul>, <p><br/></p>, <ul><li> Perform technical development of digital products that meets the consumer needs as defined by product managers and aligns with architectural standards.</li></ul>, <p><br/></p>, <ul><li>Assess a well defined problem and support the development of a technical solution that meets the needs of the business and aligns with architectural standards.</li></ul>, <p><br/></p>, <ul><li> Manage small-to moderate-sized solutions, and play a key role in larger teams, working within parameters of two- to three sprints.</li></ul>, <p><br/></p>, <ul><li> Advise product owners on discrete technology-related business problems, formulate solutions, including assessing their relative merits and risks.</li></ul>, <p><br/></p>, <ul><li> Design and implement new features and fix defects in existing code base. Write automated unit tests to validate code changes and write automated integration, tests, and manually test changes in an integrated environment. </li></ul>, <p><br/></p>, <ul><li>Debug issues found during testing and troubleshoot issues in production environment. </li></ul>, <p><br/></p>, <ul><li>Provide on-call support for production incidents and resolve them in timely manner. </li></ul>, <p><br/></p>, <ul><li>Telecommuting is available from anywhere in the U.S. except from AK, AL, AR, DE, HI, IA, ID, IN, KS, KY, LA, MT, ND, NE, NH, NM, NV, OH, OK, RI, SD, VT, WV, and WY. </li></ul>, <p><br/></p>, <p><br/></p>, <p>Employer will accept a Master’s degree in Computer Science, Computer Engineering, or Information Systems and 2 years of experience in the job offered or a computer-related occupation. Experience must include: </p>, <p> </p>, <p>• Big data and data lake systems </p>, <p>• AWS Cloud infrastructure </p>, <p>• Linux sys admin </p>, <p>• Docker containerization </p>, <p>• Terraform automation </p>, <p>• OKTA/IAM integration </p>, <p>• Jenkins pipelines </p>, <p>• Networking architectures </p>, <p>• Kubernetes administration </p>, <p>• Python coding </p>, <p>• Monitoring tools New relic, Splunk, Signalfx </p>, <p>• CM tools such as Puppet, chef, ansible </p>, <p><br/></p>, <p> </p>, <p>Apply at www.jobs.nike.com (Job #R-50041). </p>, <p><br/></p>, <p>LI-DNI</p>, <p><br/></p>, <p>We are committed to fostering a diverse and inclusive environment for all employees and job applicants. We offer a number of accommodations to complete our interview process including screen readers, sign language interpreters, accessible and single location for in-person interviews, closed captioning, and other reasonable modifications as needed. If you discover, as you navigate our application process, that you need assistance or an accommodation due to a disability, please complete the Candidate Accommodation Request Form.</p>, '\n']",2,Remote,Pay not stated
4141906992,Lunova Tech,Back End Developer,United States,Entry level,2025-02-04 08:22:14,https://www.linkedin.com/jobs/view/back-end-developer-at-lunova-tech-4141906992?trk=public_jobs_topcard-title,"['\n', <p>🔹 Back-End Developer (Remote) – Hiring Now!</p>, <p><br/></p>, <p><strong>Company Description</strong></p>, <p>We suggest you enter details here.</p>, <p><br/></p>, <p>📍 <strong>Location:</strong> United States (Remote)</p>, <p>💰 <strong>Salary:</strong> $95k - $105k Annually</p>, <p>📌 <strong>Job Type:</strong> Full-Time</p>, <p><br/></p>, <p><strong>Role Description</strong></p>, <p>This is a full-time remote role for a Back End Developer at Lunova Tech. The Back End Developer will be responsible for back-end web development, software development, object-oriented programming (OOP), front-end development, and programming tasks.</p>, <p><br/></p>, <p><strong>Qualifications</strong></p>, <ul><li>Back-End Web Development and Software Development skills</li><li>Object-Oriented Programming (OOP) skills</li><li>Front-End Development and Programming skills</li><li>Experience with databases and server-side technologies</li><li>Strong problem-solving and analytical skills</li><li>Excellent communication and teamwork abilities</li><li>Bachelor's degree in Computer Science or related field</li></ul>, '\n']",4,Remote,$95k-$105k
