l_id,company,title,location,level,posted,url,description,yoe,arrangement,pay
4142953344,BECU,Intern: Associate Software Developer,"Washington, United States",Internship,2025-02-04 08:21:19,https://www.linkedin.com/jobs/view/intern-associate-software-developer-at-becu-4142953344?trk=public_jobs_topcard-title,"['\n          Is it surprising to hear that a financial institution of 1.5 million members and over $30 billion in managed assets say that success comes from focusing on people, not profits?', <br/>, <br/>, 'Our “people helping people” philosophy has guided us since 1935, driving our deep commitment to serving our members, communities, and each other. When you join our team, you become part of a purpose-driven organization where your work makes a real difference.', <br/>, <br/>, 'While we’re proud of our history, we’re even more excited about our future. With business and technology transformation on the horizon, there’s never been a better time to be part of BECU.', <br/>, <br/>, <strong>PAY RANGE<br/><br/></strong>, 'The Target Pay Range for this position is $18 - $25/hr hourly. At BECU, compensation decisions are determined using factors such as relevant job-related skills, experience, and education or training. Should an offer for employment be made, we will consider individual qualifications. In addition to your salary, compensation incentives are available for the hired applicant. Incentives are performance based and targets vary by role.', <br/>, <br/>, <strong>Benefits<br/><br/></strong>, 'Employees and their eligible family members have access to a wide array of employee benefits, such as medical, dental, vision and life insurance coverage. Employees have access to disability and AD&D insurance. We also offer health care and dependent care flexible spending accounts, as well as health savings accounts, to eligible employees. Employees are able to enroll in our company’s 401k plan and employer-funded retirement plan. Newly hired employees accrue 6.16 hours of paid time off (PTO) on a per pay period basis based on hours worked (up to a maximum of 160 PTO hours per year) and receive ten paid holidays throughout the calendar year. Additional details regarding BECU Benefits can be found here.', <br/>, <br/>, <strong>IMPACT YOU’LL MAKE<br/><br/></strong>, 'As an ', <strong>Associate Software Developer -Intern</strong>, ' at BECU, you’ll be a key contributor to creating enterprise-class software that supports our business objectives. You’ll develop and enhance software solutions under the guidance of senior developers, gaining valuable hands-on experience in designing, coding, testing, and automating solutions. Your role will help streamline and improve business processes while providing you opportunities to grow your technical skills and contribute to meaningful projects.', <br/>, <br/>, <strong>To join our dynamic team, we require candidates to be residents of WA, OR, ID, AZ, TX, GA, or SC.</strong>, ' If you’re located in Washington state and within a reasonable driving distance from Tukwila, we are requesting that you come into our HQ on Tuesdays & Wednesdays. For those candidates that live outside the commute distance of TFC and in any of our approved remote work locations, this role will be remote. Remote or onsite, we are committed to ensuring you are fully engaged and included in our collaborative environment.', <br/>, <br/>, <strong>What You’ll Do<br/><br/></strong>, <ul><li>Collaborate with Your Team: Work closely with team members to determine the best technical solutions that meet software requirements, fostering a supportive and collaborative environment.</li><li>Design and Develop: Develop prototypes, proofs of concept, and software solutions by combining technical expertise with a growing understanding of software design concepts.</li><li>Build Quality Solutions: Write clean, scalable code for small features, automated tests, and scripts, following departmental procedures and programming standards.</li><li>Optimize Code: Identify areas of improvement in existing code and implement changes to enhance performance, maintainability, and reliability.</li><li>Streamline Processes: Automate and improve business processes with guidance from experienced team members and business experts.</li><li>Learn and Grow: Work under the mentorship of senior developers, gaining knowledge of coding best practices and advanced development techniques.</li><li>Support Deployment: Create continuous integration builds, deployment pipelines, and database migrations to support robust and reliable software deployments.</li><li>Document and Debug: Perform system analysis, write documentation, debug code, and contribute to delivering high-quality software.</li><li>Contribute to Success: Follow programming standards and participate in team efforts to meet deadlines and achieve business goals.</li><li>Perform Additional Duties: Support the team and organization by taking on additional responsibilities as assigned.<br/><br/></li></ul>, <strong>What You’ll Gain<br/><br/></strong>, <ul><li>Professional Growth: Develop technical expertise in coding, testing, automation, and deployment processes under the mentorship of senior developers.</li><li>Real-World Experience: Gain exposure to enterprise-class software development and contribute to impactful projects that drive business outcomes.</li><li>Team Collaboration: Work in a collaborative, supportive environment where your contributions are valued, and your growth is prioritized.</li><li>Technical Skills: Build your knowledge of .NET, C#, JavaScript/TypeScript, Python, and open-source technologies while gaining experience with Git, CI/CD tools, and Test-Driven Development.</li><li>Problem-Solving Skills: Enhance your ability to analyze and debug software, propose improvements, and contribute to optimizing business processes.<br/><br/></li></ul>, <strong>QUALIFICATIONS: Minimum Qualifications:<br/><br/></strong>, <ul><li>Bachelor’s degree in Computer Science or related discipline, or equivalent work experience.</li><li>Minimum of one year of experience designing software and writing production code in a team/classroom environment.</li><li>Experience delivering solutions in multiple programming languages and technical environments.</li><li>Proficiency in .NET, C#, JavaScript/TypeScript, or Python.</li><li>Knowledge of Open Source (OSS) technologies.</li><li>Understanding of SOLID design principles, Object-Oriented Programming, and Design.</li><li>Experience using Continuous Integration and Continuous Delivery tools.</li><li>Experience using Test-Driven Development concepts, methods, and tools.</li><li>Proficiency with Git for version control.</li><li>Understanding of data modeling concepts.<br/><br/></li></ul>, <strong>JOIN THE JOURNEY<br/><br/></strong>, 'At BECU, your journey as an Associate Software Developer- Intern, will be a foundation for building your career in software development. You’ll work with experienced professionals, contribute to impactful projects, and develop technical skills that set you up for long-term success. Apply now and be part of a team where your growth, innovation, and contributions are valued. Together, we’ll create exceptional solutions and make a meaningful impact.', <br/>, <br/>, '#BECU #YourGrowth #BECUJourney', <br/>, <br/>, <strong>EEO Statement<br/><br/></strong>, 'BECU is an equal opportunity employer. All qualified applicants will receive consideration for employment without regard to race, color, religion, sex, national origin, veteran status, disability, sexual orientation, gender identity, or any other protected status.\n        ']",0,Hybrid,$18-$25/hr
4142949845,BECU,Intern: Associate Software Developer,"Idaho, United States",Internship,2025-02-04 08:21:20,https://www.linkedin.com/jobs/view/intern-associate-software-developer-at-becu-4142949845?trk=public_jobs_topcard-title,"['\n          Is it surprising to hear that a financial institution of 1.5 million members and over $30 billion in managed assets say that success comes from focusing on people, not profits?', <br/>, <br/>, 'Our “people helping people” philosophy has guided us since 1935, driving our deep commitment to serving our members, communities, and each other. When you join our team, you become part of a purpose-driven organization where your work makes a real difference.', <br/>, <br/>, 'While we’re proud of our history, we’re even more excited about our future. With business and technology transformation on the horizon, there’s never been a better time to be part of BECU.', <br/>, <br/>, <strong>PAY RANGE<br/><br/></strong>, 'The Target Pay Range for this position is $18 - $25/hr hourly. At BECU, compensation decisions are determined using factors such as relevant job-related skills, experience, and education or training. Should an offer for employment be made, we will consider individual qualifications. In addition to your salary, compensation incentives are available for the hired applicant. Incentives are performance based and targets vary by role.', <br/>, <br/>, <strong>Benefits<br/><br/></strong>, 'Employees and their eligible family members have access to a wide array of employee benefits, such as medical, dental, vision and life insurance coverage. Employees have access to disability and AD&D insurance. We also offer health care and dependent care flexible spending accounts, as well as health savings accounts, to eligible employees. Employees are able to enroll in our company’s 401k plan and employer-funded retirement plan. Newly hired employees accrue 6.16 hours of paid time off (PTO) on a per pay period basis based on hours worked (up to a maximum of 160 PTO hours per year) and receive ten paid holidays throughout the calendar year. Additional details regarding BECU Benefits can be found here.', <br/>, <br/>, <strong>IMPACT YOU’LL MAKE<br/><br/></strong>, 'As an ', <strong>Associate Software Developer -Intern</strong>, ' at BECU, you’ll be a key contributor to creating enterprise-class software that supports our business objectives. You’ll develop and enhance software solutions under the guidance of senior developers, gaining valuable hands-on experience in designing, coding, testing, and automating solutions. Your role will help streamline and improve business processes while providing you opportunities to grow your technical skills and contribute to meaningful projects.', <br/>, <br/>, <strong>To join our dynamic team, we require candidates to be residents of WA, OR, ID, AZ, TX, GA, or SC.</strong>, ' If you’re located in Washington state and within a reasonable driving distance from Tukwila, we are requesting that you come into our HQ on Tuesdays & Wednesdays. For those candidates that live outside the commute distance of TFC and in any of our approved remote work locations, this role will be remote. Remote or onsite, we are committed to ensuring you are fully engaged and included in our collaborative environment.', <br/>, <br/>, <strong>What You’ll Do<br/><br/></strong>, <ul><li>Collaborate with Your Team: Work closely with team members to determine the best technical solutions that meet software requirements, fostering a supportive and collaborative environment.</li><li>Design and Develop: Develop prototypes, proofs of concept, and software solutions by combining technical expertise with a growing understanding of software design concepts.</li><li>Build Quality Solutions: Write clean, scalable code for small features, automated tests, and scripts, following departmental procedures and programming standards.</li><li>Optimize Code: Identify areas of improvement in existing code and implement changes to enhance performance, maintainability, and reliability.</li><li>Streamline Processes: Automate and improve business processes with guidance from experienced team members and business experts.</li><li>Learn and Grow: Work under the mentorship of senior developers, gaining knowledge of coding best practices and advanced development techniques.</li><li>Support Deployment: Create continuous integration builds, deployment pipelines, and database migrations to support robust and reliable software deployments.</li><li>Document and Debug: Perform system analysis, write documentation, debug code, and contribute to delivering high-quality software.</li><li>Contribute to Success: Follow programming standards and participate in team efforts to meet deadlines and achieve business goals.</li><li>Perform Additional Duties: Support the team and organization by taking on additional responsibilities as assigned.<br/><br/></li></ul>, <strong>What You’ll Gain<br/><br/></strong>, <ul><li>Professional Growth: Develop technical expertise in coding, testing, automation, and deployment processes under the mentorship of senior developers.</li><li>Real-World Experience: Gain exposure to enterprise-class software development and contribute to impactful projects that drive business outcomes.</li><li>Team Collaboration: Work in a collaborative, supportive environment where your contributions are valued, and your growth is prioritized.</li><li>Technical Skills: Build your knowledge of .NET, C#, JavaScript/TypeScript, Python, and open-source technologies while gaining experience with Git, CI/CD tools, and Test-Driven Development.</li><li>Problem-Solving Skills: Enhance your ability to analyze and debug software, propose improvements, and contribute to optimizing business processes.<br/><br/></li></ul>, <strong>QUALIFICATIONS: Minimum Qualifications:<br/><br/></strong>, <ul><li>Bachelor’s degree in Computer Science or related discipline, or equivalent work experience.</li><li>Minimum of one year of experience designing software and writing production code in a team/classroom environment.</li><li>Experience delivering solutions in multiple programming languages and technical environments.</li><li>Proficiency in .NET, C#, JavaScript/TypeScript, or Python.</li><li>Knowledge of Open Source (OSS) technologies.</li><li>Understanding of SOLID design principles, Object-Oriented Programming, and Design.</li><li>Experience using Continuous Integration and Continuous Delivery tools.</li><li>Experience using Test-Driven Development concepts, methods, and tools.</li><li>Proficiency with Git for version control.</li><li>Understanding of data modeling concepts.<br/><br/></li></ul>, <strong>JOIN THE JOURNEY<br/><br/></strong>, 'At BECU, your journey as an Associate Software Developer- Intern, will be a foundation for building your career in software development. You’ll work with experienced professionals, contribute to impactful projects, and develop technical skills that set you up for long-term success. Apply now and be part of a team where your growth, innovation, and contributions are valued. Together, we’ll create exceptional solutions and make a meaningful impact.', <br/>, <br/>, '#BECU #YourGrowth #BECUJourney', <br/>, <br/>, <strong>EEO Statement<br/><br/></strong>, 'BECU is an equal opportunity employer. All qualified applicants will receive consideration for employment without regard to race, color, religion, sex, national origin, veteran status, disability, sexual orientation, gender identity, or any other protected status.\n        ']",0,Hybrid,$18-$25/hr
4143050422,Tential Solutions,React Native Developer,"Rockville, MD",Entry level,2025-02-04 08:21:20,https://www.linkedin.com/jobs/view/react-native-developer-at-tential-solutions-4143050422?trk=public_jobs_topcard-title,"['\n          Title: React Native Developer', <br/>, <br/>, 'Location: Rockville, MD', <br/>, <br/>, 'A React Native developer is responsible for designing and building cross-platform mobile applications using the React Native framework, creating user interfaces for both iOS and Android devices from a single codebase, while ensuring optimal performance and user experience across platforms, often collaborating with designers and backend teams to deliver a seamless product.', <br/>, <br/>, <strong>Job Responsibilities<br/><br/></strong>, 'App development:?Architect, design, and develop high-quality React Native applications for iOS and Android, translating wireframes and prototypes into functional user interfaces. ?', <br/>, <br/>, 'Component creation:?Build reusable UI components with clean code, ensuring consistency across platforms. ?', <br/>, <br/>, 'Performance optimization:?Identify and address performance bottlenecks, optimizing app speed and responsiveness. ?', <br/>, <br/>, 'Native module integration:?Leverage native modules when necessary to access device-specific features like camera, geolocation, etc. ?', <br/>, <br/>, 'Testing and debugging:?Write unit and integration tests to ensure code quality, identify and resolve bugs effectively. ?', <br/>, <br/>, 'Collaboration:?Work closely with designers, product managers, and backend developers to align with project requirements. ?', <br/>, <br/>, 'Code maintenance:?Refactor and maintain existing codebase to ensure long-term stability and scalability.', <br/>, <br/>, <strong>Qualifications<br/><br/></strong>, 'Proficient in JavaScript and React: Strong understanding of JavaScript fundamentals, including ES6+ syntax, and extensive experience with React library. ?', <br/>, <br/>, 'React Native knowledge: Familiarity with React Native core concepts, navigation, state management, and native components. ?', <br/>, <br/>, 'Cross-platform development understanding: Awareness of how to build apps that function seamlessly on both iOS and Android. ?', <br/>, <br/>, 'UI/UX design principles: Ability to create visually appealing and user-friendly interfaces. ?', <br/>, <br/>, 'API integration: Experience with consuming REST APIs to fetch and manage data. ?', <br/>, <br/>, 'Testing frameworks: Proficiency in testing tools like React Testing Library. ?', <br/>, <br/>, 'Redux or other state management libraries: Knowledge of state management solutions for complex applications ?', <br/>, <br/>, 'Experience with native development: Familiarity with Swift (iOS) or Java (Android) for advanced native module integration ?', <br/>, <br/>, 'Mobile development best practices: Understanding of performance optimization techniques for mobile apps', <br/>, <br/>, '#Dice', <br/>, <br/>, '\n']",2,On-site,Pay not stated
4125879536,Atomic,Open Source Developer Tools - Research Intern,United States,Internship,2025-02-04 08:21:20,https://www.linkedin.com/jobs/view/open-source-developer-tools-research-intern-at-atomic-4125879536?trk=public_jobs_topcard-title,"[""\n          Atomic is a venture studio that builds companies from scratch. We're a team of experienced entrepreneurs and operators who have built and scaled some of the most successful startups in the world. We're passionate about creating disruptive businesses that solve real problems for users."", <br/>, <br/>, <strong>About The Role<br/><br/></strong>, 'Atomic is looking for a Research Intern to join us in starting the next big thing. Get a master class in 0-1 company creation while working directly with the team that took Hims & Hers from launch to a $3 billion public company in three years. This is a rare opportunity to get first-hand experience starting companies from scratch with a team dedicated to your success. Your contribution will shape the products we build and directly impact the direction of the companies we start.', <br/>, <br/>, ""We're looking for a Research Intern to join our team and help us launch a new developer tools company. You'll be responsible for conducting research on the open-source software space, evaluating existing projects, and identifying opportunities for new products and services."", <br/>, <br/>, <strong>Who You Are<br/><br/></strong>, <ul><li> A college or graduate student with a computer science background</li><li> Experience with developer tools and databases (bonus)</li><li> Available to work at least 5 hours per week</li><li> Interested in converting to a full-time intern in the summer<br/><br/></li></ul>, <strong>What You’ll Do<br/><br/></strong>, <ul><li> Conduct research on the open-source software spaceEvaluate existing open-source projects</li><li> Identify opportunities for new products and services</li><li> Write reports and presentations on your findings</li><li> Attend industry events and conferences<br/><br/></li></ul>, <strong>What You Get<br/><br/></strong>, <ul><li> Gain real-world experience in the open-source software space</li><li> Work with a team of experienced entrepreneurs</li><li> Be part of a disruptive new company</li><li> Make a real impact on the developer tools industry<br/><br/></li></ul>, '$30 - $50 an hour', <br/>, <br/>, 'We are focused on building a diverse and inclusive workforce. If you’re excited about this role, but do not meet 100% of the qualifications listed above, we encourage you to apply.', <br/>, <br/>, 'Atomic is an Equal Opportunity Employer and considers applicants for employment without regard to race, color, religion, sex, orientation, national origin, age, disability, genetics or any other basis forbidden under federal, state, or local law.', <br/>, <br/>, 'Please review our CCPA policies here.\n        ']",0,On-site,$30-$50 an hour
4142854362,Jobs via Dice,Python developer,United States,Entry level,2025-02-04 08:21:21,https://www.linkedin.com/jobs/view/python-developer-at-jobs-via-dice-4142854362?trk=public_jobs_topcard-title,"['\n          Dice is the leading career destination for tech experts at every stage of their careers. Our client, Amiti Consulting, Inc, is seeking the following. Apply via Dice today!', <br/>, <br/>, 'Role: Python Engineer', <br/>, <br/>, 'Location : Remote', <br/>, <br/>, 'Contract : 6+ month', <br/>, <br/>, 'Key Responsibilities:', <br/>, <br/>, 'Design, develop, and maintain RESTful APIs for various applications.', <br/>, <br/>, 'Work with databases like MySQL and PostgreSQL to manage and query data efficiently.', <br/>, <br/>, 'Collaborate with frontend teams to integrate data grids and APIs.', <br/>, <br/>, 'Leverage AWS services to deploy and manage applications in the cloud.', <br/>, <br/>, 'Write clean, maintainable, and efficient Python code.', <br/>, <br/>, 'Troubleshoot and debug application issues to ensure optimal performance.', <br/>, <br/>, 'Stay updated on emerging technologies and best practices in backend development.', <br/>, <br/>, 'Required Skills and Qualifications:', <br/>, <br/>, 'Proficiency in Python programming language.', <br/>, <br/>, 'Strong experience with REST API development.', <br/>, <br/>, 'Hands-on experience with MySQL and PostgreSQL databases.', <br/>, <br/>, 'Familiarity with cloud computing platforms, particularly AWS.', <br/>, <br/>, 'Knowledge of data grid integrations is a plus.', <br/>, <br/>, 'Strong problem-solving skills and attention to detail.', <br/>, <br/>, 'Excellent communication and teamwork abilities.\n        ']",2,Remote,Pay not stated
