l_id,company,title,location,level,posted,url,description,yoe,arrangement,pay
4142951453,BECU,Intern: Associate Software Developer,"Oregon, United States",Internship,2025-02-04 08:21:21,https://www.linkedin.com/jobs/view/intern-associate-software-developer-at-becu-4142951453?trk=public_jobs_topcard-title,"['\n          Is it surprising to hear that a financial institution of 1.5 million members and over $30 billion in managed assets say that success comes from focusing on people, not profits?', <br/>, <br/>, 'Our “people helping people” philosophy has guided us since 1935, driving our deep commitment to serving our members, communities, and each other. When you join our team, you become part of a purpose-driven organization where your work makes a real difference.', <br/>, <br/>, 'While we’re proud of our history, we’re even more excited about our future. With business and technology transformation on the horizon, there’s never been a better time to be part of BECU.', <br/>, <br/>, <strong>PAY RANGE<br/><br/></strong>, 'The Target Pay Range for this position is $18 - $25/hr hourly. At BECU, compensation decisions are determined using factors such as relevant job-related skills, experience, and education or training. Should an offer for employment be made, we will consider individual qualifications. In addition to your salary, compensation incentives are available for the hired applicant. Incentives are performance based and targets vary by role.', <br/>, <br/>, <strong>Benefits<br/><br/></strong>, 'Employees and their eligible family members have access to a wide array of employee benefits, such as medical, dental, vision and life insurance coverage. Employees have access to disability and AD&D insurance. We also offer health care and dependent care flexible spending accounts, as well as health savings accounts, to eligible employees. Employees are able to enroll in our company’s 401k plan and employer-funded retirement plan. Newly hired employees accrue 6.16 hours of paid time off (PTO) on a per pay period basis based on hours worked (up to a maximum of 160 PTO hours per year) and receive ten paid holidays throughout the calendar year. Additional details regarding BECU Benefits can be found here.', <br/>, <br/>, <strong>IMPACT YOU’LL MAKE<br/><br/></strong>, 'As an ', <strong>Associate Software Developer -Intern</strong>, ' at BECU, you’ll be a key contributor to creating enterprise-class software that supports our business objectives. You’ll develop and enhance software solutions under the guidance of senior developers, gaining valuable hands-on experience in designing, coding, testing, and automating solutions. Your role will help streamline and improve business processes while providing you opportunities to grow your technical skills and contribute to meaningful projects.', <br/>, <br/>, <strong>To join our dynamic team, we require candidates to be residents of WA, OR, ID, AZ, TX, GA, or SC.</strong>, ' If you’re located in Washington state and within a reasonable driving distance from Tukwila, we are requesting that you come into our HQ on Tuesdays & Wednesdays. For those candidates that live outside the commute distance of TFC and in any of our approved remote work locations, this role will be remote. Remote or onsite, we are committed to ensuring you are fully engaged and included in our collaborative environment.', <br/>, <br/>, <strong>What You’ll Do<br/><br/></strong>, <ul><li>Collaborate with Your Team: Work closely with team members to determine the best technical solutions that meet software requirements, fostering a supportive and collaborative environment.</li><li>Design and Develop: Develop prototypes, proofs of concept, and software solutions by combining technical expertise with a growing understanding of software design concepts.</li><li>Build Quality Solutions: Write clean, scalable code for small features, automated tests, and scripts, following departmental procedures and programming standards.</li><li>Optimize Code: Identify areas of improvement in existing code and implement changes to enhance performance, maintainability, and reliability.</li><li>Streamline Processes: Automate and improve business processes with guidance from experienced team members and business experts.</li><li>Learn and Grow: Work under the mentorship of senior developers, gaining knowledge of coding best practices and advanced development techniques.</li><li>Support Deployment: Create continuous integration builds, deployment pipelines, and database migrations to support robust and reliable software deployments.</li><li>Document and Debug: Perform system analysis, write documentation, debug code, and contribute to delivering high-quality software.</li><li>Contribute to Success: Follow programming standards and participate in team efforts to meet deadlines and achieve business goals.</li><li>Perform Additional Duties: Support the team and organization by taking on additional responsibilities as assigned.<br/><br/></li></ul>, <strong>What You’ll Gain<br/><br/></strong>, <ul><li>Professional Growth: Develop technical expertise in coding, testing, automation, and deployment processes under the mentorship of senior developers.</li><li>Real-World Experience: Gain exposure to enterprise-class software development and contribute to impactful projects that drive business outcomes.</li><li>Team Collaboration: Work in a collaborative, supportive environment where your contributions are valued, and your growth is prioritized.</li><li>Technical Skills: Build your knowledge of .NET, C#, JavaScript/TypeScript, Python, and open-source technologies while gaining experience with Git, CI/CD tools, and Test-Driven Development.</li><li>Problem-Solving Skills: Enhance your ability to analyze and debug software, propose improvements, and contribute to optimizing business processes.<br/><br/></li></ul>, <strong>QUALIFICATIONS: Minimum Qualifications:<br/><br/></strong>, <ul><li>Bachelor’s degree in Computer Science or related discipline, or equivalent work experience.</li><li>Minimum of one year of experience designing software and writing production code in a team/classroom environment.</li><li>Experience delivering solutions in multiple programming languages and technical environments.</li><li>Proficiency in .NET, C#, JavaScript/TypeScript, or Python.</li><li>Knowledge of Open Source (OSS) technologies.</li><li>Understanding of SOLID design principles, Object-Oriented Programming, and Design.</li><li>Experience using Continuous Integration and Continuous Delivery tools.</li><li>Experience using Test-Driven Development concepts, methods, and tools.</li><li>Proficiency with Git for version control.</li><li>Understanding of data modeling concepts.<br/><br/></li></ul>, <strong>JOIN THE JOURNEY<br/><br/></strong>, 'At BECU, your journey as an Associate Software Developer- Intern, will be a foundation for building your career in software development. You’ll work with experienced professionals, contribute to impactful projects, and develop technical skills that set you up for long-term success. Apply now and be part of a team where your growth, innovation, and contributions are valued. Together, we’ll create exceptional solutions and make a meaningful impact.', <br/>, <br/>, '#BECU #YourGrowth #BECUJourney', <br/>, <br/>, <strong>EEO Statement<br/><br/></strong>, 'BECU is an equal opportunity employer. All qualified applicants will receive consideration for employment without regard to race, color, religion, sex, national origin, veteran status, disability, sexual orientation, gender identity, or any other protected status.\n        ']",0,Hybrid,$18-$25/hr
4143188066,"Global Solutions Group, Inc.",AWS Cloud Developer(Secret/Top Secret Required),United States,Entry level,,https://www.linkedin.com/jobs/view/aws-cloud-developer-secret-top-secret-required-at-global-solutions-group-inc-4143188066?trk=public_jobs_topcard-title,"['\n', <p><strong>                          Full Job Description                           </strong><strong> </strong><span> </span><span> </span></p>, <p> </p>, <p><span>Title                                                                AWS Cloud Developer/Engineer</span></p>, <p><span>Work Location:                                                100% Remote</span></p>, <p><span>Duration:                                                          Long Term </span></p>, <p><span>Client:                                                                  DHS CISA</span></p>, <p><br/></p>, <p><strong>Overview</strong><span>: We are seeking an experienced AWS Cloud Engineer to lead the transition and implementation of multiple data intensive applications suite within AWS. This role is critical to the modernization of the cloud-based infrastructure and requires extensive knowledge in designing and deploying secure, scalable, and compliant AWS solutions. You will work alongside a skilled team of architects, developers, and operations professionals working on a high-visibility project with complex technical requirements.</span></p>, <p><strong>Required Qualifications</strong><span>:</span></p>, <ul><li>Bachelor’s degree in Computer Science, Information Technology, or related field.</li><li>5+ years of experience as an AWS Cloud Engineer or similar role, with a focus on infrastructure and operations in AWS.</li><li><strong>Certifications</strong>: AWS Certified Solutions Architect (Associate) or higher.</li><li>Strong hands-on experience with core AWS services, including EC2, S3, Lambda, RDS, and VPC, Fargate, EBS, ECR, EKS, Amazon Event Bridge Data Migration Services, DataSync, Glue, Athena and identity and access management services.</li><li>Strong hands-on experience with <strong>AWS Cloud Development and Data Mining</strong></li><li><span>Strong experience in API Base integration including RESTful and SOAP APIs. </span></li><li><span>Strong experience in defining data integrations including batch data integration and cross-cloud data transfer.</span></li><li><span>Proficient in event driven architecture to include Amazon EventBridge and AWS Step functions.</span></li><li>Proficiency with Infrastructure as Code tools (CloudFormation, Terraform).</li><li>Familiarity with FISMA, NIST, or other security and compliance frameworks.</li><li>Expertise in configuring AWS monitoring and logging solutions.</li><li>Solid understanding of networking and VPN technologies as they relate to AWS.</li></ul>, <p><strong>Soft Skills</strong><span>:</span></p>, <ul><li>Strong analytical, problem-solving, and troubleshooting skills.</li><li>Excellent communication skills for both technical and non-technical stakeholders.</li><li>Collaborative mindset with the ability to work in cross-functional teams.</li><li>Ability to take lead and a proactive approach to problem resolution and risk management</li></ul>, <p><strong>Key Responsibilities</strong><span>:</span></p>, <ul><li><strong>Architecting and Deployment</strong>: Design, deploy, and maintain AWS infrastructure and services that align with industry security compliance standards, focusing on high availability, scalability, and fault tolerance.</li><li><strong>Migration Strategy</strong>: Develop a seamless migration strategy to AWS, including assessing existing architecture, planning AWS equivalents, and implementing Infrastructure as Code (IaC) for consistency and scalability.</li><li><strong>Multi-Cloud and External Service Integration</strong>: Design and implement secure, seamless integration between AWS and other cloud service providers (e.g., Azure, GCP) as well as external third-party services, ensuring interoperability and alignment with PTS OSS project requirements. Leverage AWS tools like Direct Connect, API Gateway, and Lambda for cross-cloud communication, data exchange, and secure access.</li><li><strong>Infrastructure as Code (IaC)</strong>: Develop and maintain IaC using AWS CloudFormation, Terraform, or other IaC tools to automate provisioning, configuration, and deployment of AWS resources.</li><li><strong>Security and Compliance</strong>: Implement best practices for AWS security, including Identity and Access Management (IAM), Virtual Private Cloud (VPC), and AWS Config, ensuring adherence to zero-trust architecture and DHS-specific compliance.</li><li><strong>Monitoring and Optimization</strong>: Configure AWS monitoring and alerting using CloudWatch, AWS Config, and other AWS tools. Optimize performance and costs through right-sizing, reserved instances, and resource tagging.</li><li><strong>Networking</strong>: Manage and troubleshoot AWS networking solutions, including VPNs, VPCs, and Direct Connect. Collaborate to establish secure, reliable connectivity between AWS and on-premises environments.</li><li><strong>Collaboration</strong>: Work closely with project stakeholders, architects, and operations teams to design solutions that meet both technical and business requirements, including interfacing with CIO team to ensure compliance with mandates.</li><li><strong>Documentation and Knowledge Sharing</strong>: Develop comprehensive documentation for AWS architectures, security configurations, and compliance requirements. Participate in knowledge-sharing activities to ensure cross-team alignment on AWS best practices.</li></ul>, <p><br/></p>, '\n']",4,Remote,Pay not stated
4119929240,Robert Half,iOS Developer,"Pittsburgh, PA",Entry level,2025-02-04 08:21:21,https://www.linkedin.com/jobs/view/ios-developer-at-robert-half-4119929240?trk=public_jobs_topcard-title,"['\n', <strong>Salary: </strong>, '$35.63 to $41.25 hourly', <br/>, <br/>, <strong>Description<br/><br/></strong>, 'We are offering a long-term contract employment opportunity for an iOS Developer in Pittsburgh, Pennsylvania. You will be part of a team focused on developing the leading mobile commerce platform. Your role will involve working across various iOS mediums on a range of projects in a collaborative, problem-solving environment.', <br/>, <br/>, <strong>Responsibilities<br/><br/></strong>, <ul><li> Collaborate with large scale retail clients and their API developers to enhance the functionality of apps</li><li> Advise on Objective-C &amp; Swift best practices, organization, and automation to improve code quality</li><li> Participate in the development and maintenance of native iOS tools to reduce duplication of work</li><li> Contribute to third-party frameworks and implement new iOS technologies following research and experimentation</li><li> Ensure secure coding practices are followed and participate in ongoing security training and awareness</li><li> Optimize UI/UX elements within apps to provide the fastest, smoothest user experience</li><li> Share knowledge with the mobile development team to foster a learning environment</li><li> Implement and maintain app functionality for the world's largest retailers to ensure smooth operations</li><li> Use Atlassian Jira, Backend Development, Bug Tracking, Cocoa Framework, GitHub, AB Testing, Agile Scrum, Animation, and API Development skills to enhance app performance and user experience.<br/><br/><br/></li></ul>, <strong>Requirements<br/><br/></strong>, <ul><li> Proficiency in Atlassian Jira is a must for project management and tracking.</li><li> Previous experience in Backend Development is necessary to understand the overall technical needs of the project.</li><li> A strong understanding of Bug Tracking tools and methodologies is required to ensure software quality.</li><li> Familiarity with Cocoa Framework is essential for developing native iOS applications.</li><li> Experience with GitHub for version control and code sharing is necessary.</li><li> Knowledge of AB Testing is a crucial requirement for optimizing user experience and app performance.</li><li> Prior experience with Agile Scrum methodology is needed for efficient project execution.</li><li> Strong skills in Animation are necessary for developing engaging and interactive UI/UX.</li><li> Proficiency in API Development is required to ensure seamless integration with backend services.</li><li> Familiarity with Apple Devices, their features, and functionalities is needed for effective iOS app development.<br/><br/><br/></li></ul>, ""Technology Doesn't Change the World, People Do.®"", <br/>, <br/>, 'Robert Half is the world’s first and largest specialized talent solutions firm that connects highly qualified job seekers to opportunities at great companies. We offer contract, temporary and permanent placement solutions for finance and accounting, technology, marketing and creative, legal, and administrative and customer support roles.', <br/>, <br/>, 'Robert Half works to put you in the best position to succeed. We provide access to top jobs, competitive compensation and benefits, and free online training. Stay on top of every opportunity - whenever you choose - even on the go.', <br/>, <br/>, 'All applicants applying for U.S. job openings must be legally authorized to work in the United States. Benefits are available to contract/temporary professionals, including medical, vision, dental, and life and disability insurance. Hired contract/temporary professionals are also eligible to enroll in our company 401(k) plan. Visit', <br/>, <br/>, '© 2025 Robert Half. An Equal Opportunity Employer. M/F/Disability/Veterans. By clicking “Apply Now,” you’re agreeing to\n        ']",2,On-site,$35.63-$41.25 hourly
4142452825,n3xt inc,Software Engineer,United States,Entry level,2025-02-04 08:22:10,https://www.linkedin.com/jobs/view/software-engineer-at-n3xt-inc-4142452825?trk=public_jobs_topcard-title,"['\n', <strong>About N3xt Inc<br/><br/></strong>, <em><strong><strong>Liberating money<br/><br/></strong></strong></em>, <strong>About The Role<br/><br/></strong>, 'We accept all levels of seniority, as long as you have at least 2 years of working experience in a company working on an application/product in production.', <br/>, <br/>, 'We are seeking a skilled Full Stack Engineer with experience in Next.js and Node.js to join our dynamic team. The ideal candidate will be responsible for developing and maintaining web applications, associated APIs, working on data collection components, and ensuring optimal UX and performance both on the frontend and backend.', <br/>, <br/>, <strong>What You'll Do<br/><br/></strong>, <ul><li>Design, build, and maintain efficient, reusable, and reliable code using Next.js and Node.js.</li><li>Implement front-end components with Next.js framework.</li><li>Develop back-end services and APIs with Node.js.</li><li>Ensure the technical feasibility of UI/UX designs.</li><li>Collaborate with other team members and stakeholders.</li><li>Optimize applications for maximum speed and scalability.</li><li>Identify and fix bugs/performance issues.</li><li>Stay updated with emerging technologies/industry trends.<br/><br/></li></ul>, <strong>Qualifications<br/><br/></strong>, <ul><li>Proven experience as a Full Stack Engineer, preferably with TypeScript/Node.js</li><li>Solid experience with Next.js framework and Node.js platform.</li><li>Strong CSS pre-processing fundamentals.</li><li>Experience with databases (SQL/NoSQL).</li><li>Good problem-solving skills and attention to detail.</li><li>Familiarity with cloud services (e.g., Google Cloud preferred).</li><li>Knowledge of containerization (e.g., Docker).<br/><br/></li></ul>, 'Candidate must be located in EST/CST/MST to ensure team collaboration.', <br/>, <br/>, 'This position offers an opportunity to work on cutting-edge technology in a creative and collaborative environment. If you are passionate about building high-quality applications for a variety of platforms and are excited to tackle complex challenges, we would love to hear from you.\n        ']",2,On-site,Pay not stated
4142600388,Joinrs US,[Full Remote] Software Developer - Entry level,United States,Entry level,2025-02-04 08:22:11,https://www.linkedin.com/jobs/view/full-remote-software-developer-entry-level-at-joinrs-us-4142600388?trk=public_jobs_topcard-title,"['\n', <p><strong>This position is with the IBM, it is one of the largest companies in the world and a leading brand in Information Technology. At Joinrs, we look for the best professional opportunities for junior profiles and display them on our platform.</strong></p>, <p><br/></p>, <p><strong>The summary of the opportunity from <em>Joinrs AI</em>:</strong></p>, <p>IBM, a leader in technology innovation, seeks an Entry Level Software Developer for a full-time position. Candidates should have basic knowledge in programming languages and operating systems. You will participate in software development, design, and support, contributing to Open Source communities. IBM offers a culture of flexibility, career growth, and learning opportunities.</p>, <p>--</p>, <p><br/></p>, <p>At IBM, work is more than a job – it’s a calling:</p>, <p>To build. To design. To code. To consult. To think along with clients and sell. To make markets. To invent. To collaborate. Not just to do something better, but to attempt things you’ve never thought possible.</p>, <p>Are you ready to lead in this new era of technology and solve some of the world’s most challenging problems? If so, let’s talk.</p>, <p><br/></p>, <p><br/></p>, <p><strong>Your Role and Responsibilities</strong></p>, <p><br/></p>, <p><strong>Position start dates are in 2025.</strong></p>, <p>When working in this abstract, fast-paced, and continuously changing tech world, resilience, commitment, and curiosity serve as the foundation for success as an IBM Developer.</p>, <p>You will:</p>, <ul><li>Participate in many aspects of the software development lifecycle, such as design, code implementation, testing, and support.</li><li>Work to create software that is of high quality and meets our clients’ needs.</li><li>Have the opportunity to become a contributor within Open Source communities across multiple disciplines.</li></ul>, <p><strong>In your role, you will:</strong></p>, <ul><li>Be supported by mentors and coaches who will encourage you to challenge the norm, investigate ideas outside of your role, and come up with creative solutions resulting in ground-breaking impact for the wider business, our external clients, and their customers.</li></ul>, <p>Our culture of flexibility and freedom are pillars that embrace long-term career growth and learning opportunities in an environment that highlights your unique skills and experience.</p>, <p><br/></p>, <p><br/></p>, <p><strong>As an Entry Level Software Developer, you will:</strong></p>, <p><br/></p>, <ul><li>Work in an agile, collaborative environment to understand requirements, design, code, and test innovative applications, and support those applications.</li><li>Assist with resolving network issues, configuring operating systems, and using remote desktop connections to provide immediate support.</li><li>Troubleshoot issues, collect data, elicit detailed requirements, then design and implement innovative solutions across multiple industries and sectors as well as governments and agencies.</li></ul>, <p><br/></p>, <p><br/></p>, <p><strong>Who You Are</strong></p>, <p><br/></p>, <ul><li>Highly motivated and have a passion for creating and supporting great products.</li><li>Thrive on collaboration, working side by side with people of all backgrounds and disciplines, and you have very strong verbal and written communication skills.</li><li>Great at solving problems, troubleshooting, and implementing solutions to complex technical issues.</li><li>Have a basic understanding of software development and programming languages.</li><li>Have the ability to learn new skills quickly and use the skills efficiently.</li></ul>, <p><br/></p>, <p><br/></p>, <p><strong>Required Technical and Professional Expertise</strong></p>, <p><br/></p>, <ul><li>Basic knowledge in one or more of the following technology areas:</li><li>Java, Ruby, Python, JavaScript, HTML, CSS, Node.js, Angular.js</li><li>Understanding of operating system software (e.g., MacOS, Linux, Windows).</li></ul>, <p><br/></p>, <p><br/></p>, <p><strong>Preferred Technical and Professional Expertise</strong></p>, <p><br/></p>, <ul><li>Minimum 1 year experience working with operating system software (e.g., MacOS, Linux, Windows).</li><li>Minimum 1 year experience in development with JavaScript, Node.js, or similar.</li><li>One or more internships or co-op experience.</li></ul>, '\n']",0,Remote,Pay not stated
4141725462,Fast Forward,Full Stack Engineer,"Kearney, NE",Entry level,2025-02-04 08:22:11,https://www.linkedin.com/jobs/view/full-stack-engineer-at-fast-forward-4141725462?trk=public_jobs_topcard-title,"['\n          Fast Forward is seeking (1) full-time individual (local or remote) as a Full Stack Developer to join the existing dev team and contribute to our web, mobile, video recording and machine learning applications. The individual will receive guidance and mentorship from our engineering team but needs to be able to work independently and learn new technologies quickly.', <br/>, <br/>, 'Must be a USA citizen.', <br/>, <br/>, 'Job description here: https://lnkd.in/gFhQVyep', <br/>, <br/>, 'Learn more about other opportunities here: https://ff-ai.com/careers\n        ']",2,Remote,Pay not stated
