l_id,company,title,location,level,posted,url,description,yoe,arrangement,pay
4142673238,StudyFetch,Web Game Developer (Remote),"New York, United States",Entry level,2025-02-04 08:21:18,https://www.linkedin.com/jobs/view/web-game-developer-remote-at-studyfetch-4142673238?trk=public_jobs_topcard-title,"['\n', <p><span>Are you passionate about building immersive browser-based games? Do you thrive in a dynamic environment where creativity meets cutting-edge technology? We’re looking for a </span><strong>Web Game Developer</strong><span> to join our team and help bring engaging 3D gaming experiences to life.</span></p>, <p><br/></p>, <strong>What You'll Do</strong>, <ul><li><span>Develop and optimize 3D web-based games using Three.js and WebGL</span></li><li><span>Build interactive, high-performance gaming experiences with React and TypeScript</span></li><li><span>Implement game loops, physics, animations, and collision detection for smooth gameplay</span></li><li><span>Ensure optimal performance across different devices and browsers</span></li><li><span>Collaborate with designers and other developers to bring concepts to life</span></li></ul>, <p><br/></p>, <strong>Required Technical Skills</strong>, <p><span>✅ Strong proficiency with Three.js for 3D rendering, scene management, and WebGL integration (lighting, materials, camera controls)</span></p>, <p><span>✅ Advanced React development (hooks, custom components, state management with Redux/Context API)</span></p>, <p><span>✅ Solid grasp of game development principles including physics, animation, and performance optimization</span></p>, <p><span>✅ Expertise in JavaScript/TypeScript (ES6+)</span></p>, <p><br/></p>, <strong>Nice-to-Have Skills</strong>, <p><span>✨ Experience with WebGL shaders &amp; GLSL</span></p>, <p><span>✨ WebSocket implementation for real-time multiplayer features</span></p>, <p><span>✨ Canvas API for 2D game elements</span></p>, <p><span>✨ React Three Fiber (React renderer for Three.js)</span></p>, <p><span>✨ TweenJS or GSAP for animations</span></p>, <p><span>✨ Asset optimization and loading strategies</span></p>, <p><span>✨ Web Audio API for immersive sound design</span></p>, <p><br/></p>, <strong>Compensation &amp; Work Environment</strong>, <p><span>💰 </span><strong>Salary:</strong><span> Up to $100K (depending on experience)</span></p>, <p><span>🌍 </span><strong>Remote:</strong><span> Work from anywhere!</span></p>, <p><br/></p>, <p><br/></p>, '\n']",2,Remote,"$0-$100,000"
4142851681,Oleven,"Junior Software Engineer, Professional Services",United States,Entry level,2025-02-04 08:21:18,https://www.linkedin.com/jobs/view/junior-software-engineer-professional-services-at-oleven-4142851681?trk=public_jobs_topcard-title,"['\n', <p><strong>Position Overview:</strong></p>, <p>We are looking for an Early Career Software Engineer to join our Professional Services team. As a Software Engineer, you will play a crucial role in designing, developing, and delivering high-quality software solutions and integrations using C#, .NET, PostgreSQL, and AWS. In addition to your technical expertise, you will need to effectively communicate solutions to non-technical stakeholders, including clients. The ideal candidate will have a strong technical background and excellent communication skills.</p>, <p><br/></p>, <p><strong>Responsibilities</strong></p>, <p>● Collaborate with clients and internal teams to understand technical requirements and translate them into scalable software solutions.</p>, <p>● Design and develop software integrations using C#, .NET, PostgreSQL, and AWS.</p>, <p>● Communicate technical solutions to non-technical stakeholders in a clear and understandable manner.</p>, <p>● Work closely with cross-functional teams to ensure successful delivery of software solutions within project timelines.</p>, <p>● Write clean, maintainable, and well-documented code while adhering to best practices.</p>, <p>● Troubleshoot and resolve technical issues, ensuring smooth operation of applications.</p>, <p><br/></p>, <p><strong>Qualifications</strong></p>, <p><span>● Must be authorized to work in the U.S. without current or future sponsorship. (W-2 employement only).</span></p>, <p>● Bachelor's degree in Computer Science, Engineering, or a related field.</p>, <p>● Proven experience as a Software Engineer or similar role.</p>, <p>● Proficiency in C#, .NET (8.0), PostgreSQL, and AWS.</p>, <p>● Strong communication skills with the ability to convey technical concepts to non-technical audiences.</p>, <p>● Experience working in a professional services environment, interacting with clients, and understanding their business needs.</p>, <p>● Ability to work effectively in a collaborative, client-facing role.</p>, <p>● Excellent problem-solving and analytical skills.</p>, <p>● Familiarity with agile development methodologies. Preferred Qualifications:</p>, <p>● Experience working in a professional services environment, interacting with clients, and understanding their business needs.</p>, <p>● Proven experience integrating with ERPs.</p>, <p>● Proficiency in TypeScript.</p>, <p><br/></p>, <p>If you are a skilled Software Engineer with a passion for delivering top-notch software solutions and the ability to effectively integrate external systems, we encourage you to apply and become a valuable part of our Professional Services team.</p>, '\n']",0,On-site,Pay not stated
4142903062,Get It - Professional Services,Remote Software Engineer (JavaScript) | WFH Opportunity,"McLean, VA",Entry level,2025-02-04 08:21:18,https://www.linkedin.com/jobs/view/remote-software-engineer-javascript-wfh-opportunity-at-get-it-professional-services-4142903062?trk=public_jobs_topcard-title,"['\n          Join a premier online trust and safety platform that is committed to safeguarding businesses, consumers, and children from deceptive, fraudulent, and non-compliant mobile and Connected TV (CTV) applications, as well as websites. Our cutting-edge software and data solutions have garnered recognition for addressing critical challenges in digital advertising, privacy, and compliance. With a diverse and global team of professionals spanning various domains—including law, data science, engineering, and economics—we are dedicated to fostering a secure online environment.', <br/>, <br/>, <strong>Job Overview<br/><br/></strong>, 'We are seeking a highly motivated Software Engineer with a specialization in JavaScript to enhance our dynamic team. The successful candidate will possess a robust understanding of web technologies, browser behaviors, DOM manipulation, and video player integration. Experience within the ad tech industry is advantageous.', <br/>, <br/>, <strong>Key Responsibilities<br/><br/></strong>, <ul><li>Design, develop, and enhance our measurement scripts and front-end applications utilizing JavaScript, HTML, and CSS.</li><li>Maintain and update our implementation of the Open Measurement Software Development Kit (OMSDK) for enhanced ad measurement and verification.</li><li>Collaborate with cross-functional teams to test and integrate new features effectively.</li><li>Troubleshoot and resolve performance issues within browsers and video players.</li><li>Partner with the Quality Assurance team to deliver high-quality products.</li><li>Remain abreast of the latest advancements in web technologies and ad tech.<br/><br/></li></ul>, <strong>Required Skills<br/><br/></strong>, <ul><li>Proficient in JavaScript, with a thorough understanding of its fundamental principles.</li><li>Familiarity with front-end frameworks and libraries such as React, Angular, or Vue.js.</li><li>Comprehensive knowledge of browser internals, DOM manipulation, and video player integration.</li><li>Experience with RESTful APIs and asynchronous programming techniques.</li><li>Knowledge of OMSDK and its application in ad tech solutions.</li><li>Strong analytical and problem-solving skills with meticulous attention to detail.</li><li>Effective communication and teamwork capabilities.<br/><br/></li></ul>, <strong>Qualifications<br/><br/></strong>, <ul><li>Bachelor's degree in Computer Science, Software Engineering, or a related field.</li><li>Demonstrable experience with JavaScript and front-end development frameworks.</li><li>Exposure to industry practices related to ad tech is a plus.<br/><br/></li></ul>, <strong>Career Growth Opportunities<br/><br/></strong>, 'We offer abundant opportunities for professional advancement and personal development within a culture that promotes growth and success.', <br/>, <br/>, <strong>Company Culture And Values<br/><br/></strong>, 'Our work environment fosters innovation and collaboration, motivating team members to challenge each other and reach their highest potential. We value diversity and inclusivity, reinforcing our mission to create a safe online space.', <br/>, <br/>, <strong>Compensation And Benefits<br/><br/></strong>, 'Join us for a rewarding career with competitive compensation packages, including:', <br/>, <br/>, <ul><li>Monthly reimbursement for internet expenses.</li><li>Flexible remote work options and hours.</li><li>Exciting annual team events.</li><li>A supportive atmosphere that prioritizes both success and enjoyment.<br/><br/></li></ul>, 'Employment Type: Full-Time\n        ']",2,Remote,Pay not stated
4142867016,Flexi-Inspire,E-Learning Curriculum Developer,United States,Entry level,2025-02-04 08:21:19,https://www.linkedin.com/jobs/view/e-learning-curriculum-developer-at-flexi-inspire-4142867016?trk=public_jobs_topcard-title,"['\n', <p><span>Remote Learning Content Creator (This Position Requires 10 Hours Per Week)</span></p>, <p><span>(This Position Starts as an unpaid Internship)</span></p>, <p><span>Are you passionate about education and ready to inspire the next generation of learners? Flexi Solutions is on the lookout for innovative, creative, and tech-savvy individuals who are eager to create impactful educational content that reaches K-12 students or their parents around the globe.</span></p>, <p><br/></p>, <p><strong>About Us</strong></p>, <p><span>At Flexi Solutions, we’re more than just an online education platform—we’re a community dedicated to transforming how children learn, no matter where they are or what their circumstances might be. We’re driven by a mission to provide world-class educational opportunities to every child, bridging gaps in access to quality learning tools and resources. Our diverse team of educators, professionals, and industry leaders collaborate to build innovative educational experiences that empower children and support parents on their learning journey.</span></p>, <p><br/></p>, <p><strong>Your Role</strong></p>, <p><span>As a Remote Learning Content Creator, you’ll be at the heart of our mission to revolutionize education. You’ll develop fun and innovative content, crafting lesson plans, activities, and interactive resources that make learning come alive for K-12 students or their parents. You’ll work closely with our team to ensure that every piece of content is engaging, accessible, and effective for a wide range of learning needs.</span></p>, <p><br/></p>, <p><strong>What We’re Looking For</strong></p>, <p><span>- Passion for Education: You’re deeply committed to making learning exciting and accessible for everyone.</span></p>, <p><span>- Creative Mindset: You can turn any subject into a captivating lesson that students and parents will love.</span></p>, <p><span>- Strong Writing Skills: You’re skilled at breaking down complex concepts and presenting them in a clear, engaging way.</span></p>, <p><span>- Tech-Savvy: You’re comfortable using digital tools to create and share content.</span></p>, <p><span>- Flexibility and Initiative: You’re proactive, adaptable, and ready to take on new challenges in a fast-paced environment.</span></p>, <p><br/></p>, <p><strong>Why Join Us? </strong></p>, <p><span>- Flexibility: Work remotely!</span></p>, <p><span>- Impact: Help shape the future of education and make a real difference in the lives of K-12 students and their parents.</span></p>, <p><span>- Growth: Develop your skills and grow your career in a supportive, collaborative environment.</span></p>, <p><br/></p>, <p><strong>Compensation</strong></p>, <p><span>This Position starts as an unpaid internship. There may be opportunities in the future for paid positions.</span></p>, <p><br/></p>, <p><strong>Ready to Make a Difference?</strong></p>, <p><span>If you’re excited about the opportunity to inspire students and transform education, we want to hear from you! Send your resume to support@flexi-edu.com and let us know why you’re the perfect fit for our team.</span></p>, <p><br/></p>, <ul><li><span>Together, let’s build a brighter future for education!</span></li></ul>, <p><br/></p>, '\n']",0,Remote,Pay not stated
4142892774,Exugo,Full-Stack Developer with AI/ML Experience,"New York, United States",Entry level,2025-02-04 08:21:19,https://www.linkedin.com/jobs/view/full-stack-developer-with-ai-ml-experience-at-exugo-4142892774?trk=public_jobs_topcard-title,"['\n', <strong>Full-Stack Developer with AI/ML Experience | Exugo (Startup) | Equity &amp; Growth Opportunity (multiple positions available)</strong>, <p>📍 <strong>Location:</strong> Remote or Hybrid (East Coast Preferred)</p>, <p> 💼 <strong>Type:</strong> Full-Time | Equity Options Available</p>, <p> 🚀 <strong>About Exugo:</strong></p>, <p> Exugo is the hub for pioneers shaping the future of AI, automation, and transformative technology. Currently in stealth mode, we are building a next-gen platform for innovation and collaboration. Join us as we launch in 2025.</p>, <strong>🔹 What You’ll Do</strong>, <ul><li><strong>Develop &amp; Scale:</strong> Build and optimize Exugo’s AI-driven platform, integrating <strong>web-based UX/UI</strong> with <strong>AI-powered tools.</strong></li><li><strong>Architect &amp; Design:</strong> Lead the development of a <strong>robust, scalable full-stack system</strong> that enables seamless automation and collaboration.</li><li><strong>Integrate AI/ML:</strong> Implement <strong>machine learning algorithms, NLP models, and automation tools</strong> into Exugo’s platform.</li><li><strong>Cloud &amp; Security:</strong> Ensure smooth <strong>AWS/Azure deployment</strong>, backend efficiency, and high-level security.</li><li><strong>Innovate &amp; Own:</strong> You’ll have a <strong>high-impact role</strong> in shaping the future of AI-driven collaboration.<br/></li></ul>, <p> ✅ <strong>Full-Stack Proficiency</strong> – Expertise in <strong>React, Next.js, Node.js, Python, or Go</strong> for scalable web development.</p>, <p> ✅ <strong>AI/ML Experience</strong> – Hands-on experience with <strong>LLMs, NLP, TensorFlow, PyTorch, OpenAI API, or similar frameworks.</strong></p>, <p> ✅ <strong>Database &amp; Cloud Knowledge</strong> – Comfortable working with <strong>PostgreSQL, Firebase, MongoDB, AWS, or Google Cloud.</strong></p>, <p> ✅ <strong>Product Builder Mindset</strong> – Someone who thrives in <strong>fast-paced, early-stage startups</strong> and can think creatively.</p>, <p> ✅ <strong>Passion for AI &amp; Innovation</strong> – Excited about <strong>building tools that drive real impact</strong> in emerging industries.</p>, <p><br/></p>, <strong>🔹 Why Join Us?</strong>, <p>💡 <strong>Equity &amp; Leadership Opportunity</strong> – Be a <strong>key player in a high-growth startup</strong> from the ground up.</p>, <p> 🌎 <strong>Work on Cutting-Edge AI</strong> – Build something that <strong>pushes boundaries in AI, automation, and web innovation.</strong></p>, <p> ⚡ <strong>Fast-Paced, High-Impact Role</strong> – Your work will <strong>directly shape the Exugo platform.</strong></p>, <p> 📍 <strong>Remote/Hybrid Flexibility</strong> – Work from anywhere, with options to collaborate in NY/NJ.</p>, <p><br/></p>, <strong>🔥 Additional Opportunities at Exugo</strong>, <p>🚀 <strong>Contract and Part-Time Positions Available for:</strong></p>, <p>✅ <strong>Social Media &amp; Community Manager</strong> – Help build and engage our online presence across LinkedIn, Twitter, and emerging platforms.</p>, <p>✅ <strong>AI Research Assistant</strong> – Support the integration of AI/ML tools, research emerging technologies, and assist with data modeling.</p>, <p>✅ <strong>UI/UX Designer</strong> – Create sleek, user-friendly designs to enhance Exugo’s platform experience.</p>, <p>✅ <strong>Technical Writer &amp; Content Strategist</strong> – Develop compelling articles, whitepapers, and product documentation.</p>, <p>✅ <strong>Business Development &amp; Partnerships</strong> – Help drive collaborations and strategic alliances for Exugo’s growth.</p>, <p>💡 <strong>Interested in joining our team?</strong> Send your resume to: klaudet@energypn.com</p>, '\n']",2,Hybrid,Pay not stated
4142954139,BECU,Intern: Associate Software Developer,"Arizona, United States",Internship,2025-02-04 08:21:19,https://www.linkedin.com/jobs/view/intern-associate-software-developer-at-becu-4142954139?trk=public_jobs_topcard-title,"['\n          Is it surprising to hear that a financial institution of 1.5 million members and over $30 billion in managed assets say that success comes from focusing on people, not profits?', <br/>, <br/>, 'Our “people helping people” philosophy has guided us since 1935, driving our deep commitment to serving our members, communities, and each other. When you join our team, you become part of a purpose-driven organization where your work makes a real difference.', <br/>, <br/>, 'While we’re proud of our history, we’re even more excited about our future. With business and technology transformation on the horizon, there’s never been a better time to be part of BECU.', <br/>, <br/>, <strong>PAY RANGE<br/><br/></strong>, 'The Target Pay Range for this position is $18 - $25/hr hourly. At BECU, compensation decisions are determined using factors such as relevant job-related skills, experience, and education or training. Should an offer for employment be made, we will consider individual qualifications. In addition to your salary, compensation incentives are available for the hired applicant. Incentives are performance based and targets vary by role.', <br/>, <br/>, <strong>Benefits<br/><br/></strong>, 'Employees and their eligible family members have access to a wide array of employee benefits, such as medical, dental, vision and life insurance coverage. Employees have access to disability and AD&D insurance. We also offer health care and dependent care flexible spending accounts, as well as health savings accounts, to eligible employees. Employees are able to enroll in our company’s 401k plan and employer-funded retirement plan. Newly hired employees accrue 6.16 hours of paid time off (PTO) on a per pay period basis based on hours worked (up to a maximum of 160 PTO hours per year) and receive ten paid holidays throughout the calendar year. Additional details regarding BECU Benefits can be found here.', <br/>, <br/>, <strong>IMPACT YOU’LL MAKE<br/><br/></strong>, 'As an ', <strong>Associate Software Developer -Intern</strong>, ' at BECU, you’ll be a key contributor to creating enterprise-class software that supports our business objectives. You’ll develop and enhance software solutions under the guidance of senior developers, gaining valuable hands-on experience in designing, coding, testing, and automating solutions. Your role will help streamline and improve business processes while providing you opportunities to grow your technical skills and contribute to meaningful projects.', <br/>, <br/>, <strong>To join our dynamic team, we require candidates to be residents of WA, OR, ID, AZ, TX, GA, or SC.</strong>, ' If you’re located in Washington state and within a reasonable driving distance from Tukwila, we are requesting that you come into our HQ on Tuesdays & Wednesdays. For those candidates that live outside the commute distance of TFC and in any of our approved remote work locations, this role will be remote. Remote or onsite, we are committed to ensuring you are fully engaged and included in our collaborative environment.', <br/>, <br/>, <strong>What You’ll Do<br/><br/></strong>, <ul><li>Collaborate with Your Team: Work closely with team members to determine the best technical solutions that meet software requirements, fostering a supportive and collaborative environment.</li><li>Design and Develop: Develop prototypes, proofs of concept, and software solutions by combining technical expertise with a growing understanding of software design concepts.</li><li>Build Quality Solutions: Write clean, scalable code for small features, automated tests, and scripts, following departmental procedures and programming standards.</li><li>Optimize Code: Identify areas of improvement in existing code and implement changes to enhance performance, maintainability, and reliability.</li><li>Streamline Processes: Automate and improve business processes with guidance from experienced team members and business experts.</li><li>Learn and Grow: Work under the mentorship of senior developers, gaining knowledge of coding best practices and advanced development techniques.</li><li>Support Deployment: Create continuous integration builds, deployment pipelines, and database migrations to support robust and reliable software deployments.</li><li>Document and Debug: Perform system analysis, write documentation, debug code, and contribute to delivering high-quality software.</li><li>Contribute to Success: Follow programming standards and participate in team efforts to meet deadlines and achieve business goals.</li><li>Perform Additional Duties: Support the team and organization by taking on additional responsibilities as assigned.<br/><br/></li></ul>, <strong>What You’ll Gain<br/><br/></strong>, <ul><li>Professional Growth: Develop technical expertise in coding, testing, automation, and deployment processes under the mentorship of senior developers.</li><li>Real-World Experience: Gain exposure to enterprise-class software development and contribute to impactful projects that drive business outcomes.</li><li>Team Collaboration: Work in a collaborative, supportive environment where your contributions are valued, and your growth is prioritized.</li><li>Technical Skills: Build your knowledge of .NET, C#, JavaScript/TypeScript, Python, and open-source technologies while gaining experience with Git, CI/CD tools, and Test-Driven Development.</li><li>Problem-Solving Skills: Enhance your ability to analyze and debug software, propose improvements, and contribute to optimizing business processes.<br/><br/></li></ul>, <strong>QUALIFICATIONS: Minimum Qualifications:<br/><br/></strong>, <ul><li>Bachelor’s degree in Computer Science or related discipline, or equivalent work experience.</li><li>Minimum of one year of experience designing software and writing production code in a team/classroom environment.</li><li>Experience delivering solutions in multiple programming languages and technical environments.</li><li>Proficiency in .NET, C#, JavaScript/TypeScript, or Python.</li><li>Knowledge of Open Source (OSS) technologies.</li><li>Understanding of SOLID design principles, Object-Oriented Programming, and Design.</li><li>Experience using Continuous Integration and Continuous Delivery tools.</li><li>Experience using Test-Driven Development concepts, methods, and tools.</li><li>Proficiency with Git for version control.</li><li>Understanding of data modeling concepts.<br/><br/></li></ul>, <strong>JOIN THE JOURNEY<br/><br/></strong>, 'At BECU, your journey as an Associate Software Developer- Intern, will be a foundation for building your career in software development. You’ll work with experienced professionals, contribute to impactful projects, and develop technical skills that set you up for long-term success. Apply now and be part of a team where your growth, innovation, and contributions are valued. Together, we’ll create exceptional solutions and make a meaningful impact.', <br/>, <br/>, '#BECU #YourGrowth #BECUJourney', <br/>, <br/>, <strong>EEO Statement<br/><br/></strong>, 'BECU is an equal opportunity employer. All qualified applicants will receive consideration for employment without regard to race, color, religion, sex, national origin, veteran status, disability, sexual orientation, gender identity, or any other protected status.\n        ']",0,Hybrid,$18-$25/hr
