l_id,company,title,location,level,posted,url,description,yoe,arrangement,pay
4104248976,Algo Capital Group,Full Stack Engineer,"Chicago, IL",Mid-Senior level,2025-01-30 10:20:16,https://www.linkedin.com/jobs/view/full-stack-engineer-at-algo-capital-group-4104248976?trk=public_jobs_topcard-title,"['\n', <p><strong>About Our Client:</strong></p>, <p><br/></p>, <p>A high performing proprietary trading firm is growing their rapidly evolving crypto trading team. You will be designing and implementing Java based tools as well as microservices and API Integration for a crypto desk working with state of the art technologies and the strongest engineers worldwide.</p>, <p><br/></p>, <p>This team is responsible for building, designing and developing the full stack of software, tools, and technologies for Order Management Systems (OMS) ,FIX Connectivity, and Trade Flow Analytics serving core infrastructure services using Java and some Python.</p>, <p><br/></p>, <p><strong>Core Focus Areas:</strong></p>, <ul><li>Lead development of market data processing engines and execution platforms powering 24/7 global digital asset operations</li><li>Build high-throughput order management systems (OMS), FIX connectivity layers, and real-time analytics dashboards</li><li>Develop across multiple technology stacks; Java backend systems, Python automation frameworks and TypeScript.</li><li>Drive system modernization while maintaining legacy platforms and support production systems as part of on-call rotation</li><li>Partner with front office, middle office and engineering teams to drive the production environment.</li></ul>, <p><br/></p>, <p><strong>Qualifications:</strong></p>, <ul><li>Years of experience with building enterprise Java systems</li><li>Strong experience developing automation frameworks, preferably in Python scripting</li><li>Deep understanding of market data protocols, multicast networks and websocket implementations</li><li>Experience with order processing engines and matching systems</li><li>Hands- on with Message queuing systems, Microservices architectures and RESTful API design</li><li>Trading platform experience preferably in post- trade or transactional systems</li></ul>, <p><br/></p>, <p>Excellent competitive compensation with great growth opportunities, cash bonus scheme, benefits on offer, and a business that encourages you to learn new skills and apply them to your job on a daily basis while collaborating with some of the most innovative minds in the crypto space.</p>, <p><br/></p>, <p>Apply directly or email: nsoliman@algocapitalgroup.com</p>, <p><br/></p>, <p>linkedin.com/company/algocapitalgroup - Follow Algo Capital for the latest job updates.</p>, <p></p>, '\n']",2-4,On-site,Pay not stated
4138639202,Vibes,Software Engineer,"Chicago, IL",Mid-Senior level,2025-01-30 10:20:17,https://www.linkedin.com/jobs/view/software-engineer-at-vibes-4138639202?trk=public_jobs_topcard-title,"['\n', <p>Vibes helps marketing, loyalty, and customer experience professionals at the world's most respected brands unlock new revenue and better service their customers by arming them with the technology and expertise they need to succeed in digital mobile marketing &amp; engagement. The Vibes Mobile Engagement Platform enables marketers to easily manage and analyze all mobile communication channels including intelligent programmatic text messaging (SMS/MMS), push notifications, Apple Wallet, Google Wallet and mobile web campaigns — all through a single unified interface. Vibes has delivered more than ten billion mobile experiences on behalf of customers that include Polo Ralph Lauren, Chipotle, Discover, Kohl’s and Allstate. To learn more about Vibes, visit www.vibes.com.</p>, <p><br/></p>, <p><strong>Position Overview:</strong></p>, <p>We are seeking a collaborative, proactive, and results-driven full stack Software Engineer to join our dynamic and primarily remote team. In this role, you will play a crucial part in the development and maintenance of our cloud-based applications, with a focus on both backend Ruby on Rails and frontend React development. Additionally, you will be responsible for deploying and managing infrastructure using Terraform and ensuring optimal performance and scalability on AWS cloud services.</p>, <p><br/></p>, <p>An ideal candidate possesses a growth mindset, strategic thinking capacity, and strong communication skills. This role holds significant impact at Vibes during a period of exciting growth. In a world marked by constant change and uncertainty, one area that's growing rapidly is the digital consumer engagement space. Specifically, how brands establish personalized, 1-on-1 interactions with consumers at scale. This role places you at the heart of this exciting evolution in consumer engagement. If you're eager to build systems that offer large enterprises the latest innovations in mobile marketing technology and spread positive vibes, then you have an opportunity to thrive here.</p>, <p><br/></p>, <p>This is a full-time, hybrid position based in the greater Chicago metro area, reporting to the Director of Platform Engineering. In 2024, Vibes was recognized as a Built In Best Hybrid Place to Work.</p>, <p><br/></p>, <p><strong>Responsibilities:</strong></p>, <ul><li>Develop and maintain robust, scalable, and high-performance backend solutions using Ruby on Rails, incorporating serverless architecture, microservices, and BFF patterns.</li><li>Design and implement responsive frontend interfaces using React.js/Typescript ensuring a seamless user experience.</li><li>Collaborate with cross-functional teams to understand requirements, architect solutions, and deliver features within established timelines.</li><li>Deploy and manage infrastructure components on AWS cloud using Terraform, ensuring reliability, security, and scalability.</li><li>Troubleshoot and debug issues across the full stack, from frontend UI elements to backend database queries.</li><li>Generalize in technology by maintaining broad knowledge about the entire system and the technologies used.</li><li>Own systems by designing and implementing larger initiatives, owning the production operations and monitoring of the system, and being aware of its SLAs.</li><li>Proactively support other team members and help them to be successful.</li><li>Challenge team processes, looking for ways to improve them.</li><li>Create an impact on the team as a whole vs. specific parts of it.</li></ul>, <p><br/></p>, <p><strong>Requirements &amp; Qualifications:</strong></p>, <ul><li>Bachelor's degree in Computer Science, Engineering, or related field.</li><li>3+ years of professional experience as a Software Engineer, with a focus on full stack development.</li><li>Strong proficiency in backend development using Ruby on Rails, with a solid understanding of object-oriented programming principles.</li><li>Hands-on experience in frontend development using React.js, including state management with Redux or similar libraries.</li><li>Proficiency in serverless architecture, microservices, and BFF patterns.</li><li>Hands-on experience deploying and managing cloud infrastructure on AWS using Terraform or similar tools.</li><li>Familiarity with containerization technologies such as Docker and container orchestration platforms is a plus.</li><li>Passion for learning and staying updated on emerging technologies, best practices, and industry trends.</li><li>Proven track record of driving innovation and implementing cutting-edge solutions.</li><li>Dedication to delivering high-quality solutions that meet the needs of our clients and stakeholders, with a focus on usability, reliability, and scalability.</li><li>Excellent problem-solving skills and the ability to troubleshoot complex issues across the full stack.</li><li>Strong communication and collaboration skills, with the ability to work effectively in a fast-paced, team-oriented environment.</li><li>Ability and willingness to travel to Vibes' downtown Chicago, IL, office several times a month.</li><li>Authorized to work in the United States without the need for current or future employer sponsorship.</li></ul>, <p><br/></p>, <p><strong>Our Core Values:</strong></p>, <ul><li>Respect, Honesty, and Integrity for All Stakeholders</li><li>Always be Learning</li><li>Relentless Focus on the Customer</li><li>Never be Satisfied</li><li>Create Value</li><li>Seek Accountability and Ownership</li></ul>, <p><br/></p>, <p><strong><u>Compensation and Benefits</u></strong></p>, <p>The compensation range for this role is $95,000 to $115,000. Final compensation will be determined by factors such as relevant work experience, skills, and certifications. Vibes offers a full slate of benefits from competitive salaries, options, medical, dental and vision coverage, short- and long-term disability, life insurance, 12 paid holidays, flexible vacation, summer Fridays, Winter Holiday break, commuter benefits, a 401(k) plan and match, and a paid parental leave program.</p>, <p><br/></p>, <p><strong><u>Equal Opportunity</u></strong></p>, <p>Vibes is proud to be an Equal Opportunity Employer and provides equal employment opportunities to all employees and applicants regardless of race, color, religion, gender, gender identity, age, national origin, disability, parental or pregnancy status, marriage and civil partnership, sexual orientation, veteran status, or any other characteristic protected by law. Reasonable accommodations will be made to meet the requirements of the Americans with Disabilities Act and will be provided as requested by candidates taking part in all aspects of the selection process.</p>, '\n']",3+,Hybrid,"$95,000-$115,000"
4138717722,Blitt & Gaines Law Offices,Software Developer,"Vernon Hills, IL",Entry level,2025-01-30 10:20:17,https://www.linkedin.com/jobs/view/software-developer-at-blitt-gaines-law-offices-4138717722?trk=public_jobs_topcard-title,"['\n', <strong>Description<br/><br/></strong>, <strong>Job Title: </strong>, 'Software Developer', <br/>, <br/>, <strong>Job Summary<br/><br/></strong>, 'As a developer, you will be working with Blitt and Gaines, P.C.’s product development team, building and testing web and mobile applications utilizing SQL, HTML5, C#, and Power BI. This role will also continually review the historical and on-going accuracy and integrity of the data and reports generated from our systems.', <br/>, <br/>, 'This is an experienced level position with opportunity for potential advancement into further development roles within the firm. You will work under the Executive Director of Operations and our senior programmers and work to build a variety of types of applications for our firm.', <br/>, <br/>, <strong>Responsibilities And Duties<br/><br/></strong>, <ul><li>The individual in this position will be expected to execute complex data queries, integrate and manipulate data from multiple sources, and apply appropriate research and statistical methods in order to produce both internal &amp; external reports.</li><li>Uses SQL to query, analyze and integrate internal, client data. </li><li>Skills with AI and Machine Learning</li><li>Develop C# .net solutions for the organization.</li><li>Critically reviews and revises existing processes and applications for updates to methodologies and program enhancements.</li><li> Identifies data, systems and operations problems and recommends solutions and changes to streamline procedures for more effective reporting. Diagnose root causes and making recommendations to management.</li><li>Performs quality assurance to evaluate data quality and integrity.</li><li>Interprets results and prepares findings for presentation to internal and external audiences.</li><li>Analyzes system technical requirements and provides appropriate input to the development or selection of solutions, taking into consideration project constraints.</li><li>Participates in the design and configuration of input forms, screen designs, tables, system outputs, and interfaces that meet the business needs of the customer.</li><li>Develops and maintains the technical skills necessary for system configuration and system administration activities. Assists team members in developing configuration skills, as needed.</li><li>Ensures that system technical design is consistent with institutional and regulatory standards.</li><li>Analyzes application needs in the department and configures current applications or develops new applications to support them. Incorporates feedback from the appropriate departmental personnel applications are configured or developed.</li><li>To Process, cleanse data and collate date, analyze that data using SQL and create reports on data using SSRS as per request from Stake holders and colleagues.</li><li>The SQL Report Writer will gain an understanding of client needs and then develop customized SSRS reports and prepare data for new implementations. </li><li>The SQL Report Writer will also be responsible for optimization and reliability while also developing stored procedures as well as other complex SQL queries.</li><li> Designing, developing, testing and implementing web-based and SQL server reporting applications that support the requirements defined by users and analysts.</li><li> Developing and performing regular data quality checking processes ensuring data from source systems is correctly flowing through to our systems.<br/><br/></li></ul>, <strong>Minimal Job Qualifications And Requirements<br/><br/></strong>, <ul><li> Bachelor’s degree in Computer Science or related field</li><li> 2 yrs minimum experience in SQL and C# is required</li><li> Experience with Power BI</li><li> Knowledge of other coding languages (Java, C+)</li><li>AI Bot Experience is a must</li><li> Building dashboards, data warehousing</li><li> Ability to write clean, easy to understand code</li><li> Strong written and oral communication skills</li><li> Analytical problem solving skills</li><li> Demonstrates the ability to think independently and use good judgment</li><li> Fundamental knowledge of Microsoft Office Products</li><li>Be open to learning and using whatever technologies are needed. We are pragmatic-as opposed to philosophical-about our tools.</li><li>Be detailed-oriented.</li><li>Be able to follow directions and adhere to established, repeatable programming patterns.<br/><br/></li></ul>, <strong>Benefits<br/><br/></strong>, 'Blitt and Gaines, P.C. offers PTO, Paid Holidays, Medical Benefits, Competitive Salary and 401k and profit sharing plans! Medical Benefits include - Medical, Dental, Vision, Life Insurance and Short Term Disability.\n        ']",2-4,On-site,Pay not stated
4138263281,Walter P Moore,Front-end Software Developer,"Chicago, IL",Entry level,2025-01-30 10:20:18,https://www.linkedin.com/jobs/view/front-end-software-developer-at-walter-p-moore-4138263281?trk=public_jobs_topcard-title,"['\n', <strong>Responsibilities<br/><br/></strong>, 'We are looking for a motivated, adaptable, proficient front-end developer. Someone who can understand the product goals, has the appetite for experimentation, who loves to learn new technologies and will take the initiative to propose and create appropriate solutions/options for changing situations.', <br/>, <br/>, 'The ideal candidate would have experience with React and be able to work as a front-end developer on a larger team or have a broader experience in either UI/UX and/or database/API integration. Our team is responsible for developing and designing front-end web solutions to support the building design lifecycle.', <br/>, <br/>, 'We are looking for candidates who are ready to roll up their sleeves and get work done!', <br/>, <br/>, 'The Type of Person That Will Excel:', <br/>, <br/>, <ul><li> You are curious, inquisitive, and have demonstrated a constant eagerness to learn through actions </li><li> Excellent communications skills </li><li> You have a “can-do” attitude and are willing to go beyond the basic requirements of the position </li><li> You demonstrate personal accountability and integrity in all actions <br/><br/></li></ul>, <strong> Key Responsibilities: <br/><br/></strong>, <ul><li> Gather requirements from stakeholders and work collaboratively within a team as well as independently on assigned projects </li><li> Develop responsive and user-friendly web interfaces using React, HTML and CSS. </li><li> Integrate front-end and back-end components to create seamless, end-to-end web applications. </li><li> Build and own quality throughout the development cycle by writing automated unit tests, integration tests, functional tests, and UI tests </li><li> Iteratively build application features to allow users to compare interactions with multiple options. </li><li> Implement completely new features from scratch and work through integration of those features with the rest of the codebase. </li><li> Constantly learning innovative technologies and new ways of approaching a problem <br/><br/></li></ul>, <strong>Qualifications<br/><br/></strong>, <ul><li> Bachelor’s degree in computer science or related work experience </li><li> Strong in JavaScript (ES6), HTML, and CSS </li><li> Strong Web UI framework experience (React, Next JS, etc …) </li><li> Able to implement completely new features from scratch and work through integration of those features with the rest of the codebase. </li><li> Can write code that is ES Lint-compliant and cross-browser compatible </li><li> High level of proficiency in Git </li><li> Strong communication , customer service, troubleshooting, organizational skills, work prioritization, self-direction, and the ability to complete assigned work. </li><li> Excellent English fluency, both spoken and written. </li><li> Ability to work from your home without disruptions <br/><br/></li></ul>, <strong> Desi red, but not Required: <br/><br/></strong>, <ul><li> Three.JS or React Three Fiber/Drei </li><li> Continuous Integration experience </li><li> E xperience with SharePoint framework, MongoDB or SQL </li><li> Prototyping experience: Adobe XD/Figma (with examples) </li><li> Experience with Azure DevOps, release pipelines, application insights, blob storage. </li><li> Experience extending Flask APIs with Python </li><li> Some graphic design experience (e.g., Adobe InDesign, Illustrator, and Photoshop; and Microsoft PowerPoint) </li><li> Experience with one or more test automation frameworks <br/><br/></li></ul>, <strong> Hybrid Firm Po sition : <br/><br/></strong>, 'As a Hybrid Firm, Walter P Moore combines the best of both worlds – blending work options to include in-office and home office environments . This allows us to offer more flexibility and work-life integration to our employees . Candidates applying for this position should have the ability to commute to or periodically travel to the affiliated office.', <br/>, <br/>, 'To ensure the ability to setup a suitable home office space, Walter P Moore offers a one-time $1,000 stipend that would be paid upon completion of the first week of employment. An additional $50 monthly stipend will also be provided to cover ongoing home office expenses .', <br/>, <br/>, <strong>Overview<br/><br/></strong>, 'Walter P Moore is an international company of consultants, architects, engineers, innovators, and creative people who solve some of the world’s most complex structural and infrastructural challenges. Providing structural, diagnostics, civil, water resources, traffic, transportation engineering, parking and technology consulting services, we develop solutions that are cost- and resource-efficient, forward-thinking, and help support and shape our communities. Founded in 1931, we are headquartered in Houston, Texas and have more than 800 professionals working across 24 U.S. offices and 7 international locations.\n        ']",2-4,Hybrid,Pay not stated
4138700996,Gridlines,Founding Software Engineer,"Chicago, IL",Mid-Senior level,2025-01-30 10:20:18,https://www.linkedin.com/jobs/view/founding-software-engineer-at-gridlines-4138700996?trk=public_jobs_topcard-title,"['\n          Job Description: Full-Stack Engineer. ', <strong>Must have 3+ years of work experience as a software engineer.<br/><br/></strong>, ""Note: We are a team of two people, you will be the third! This means you'll have a LOT of responsibility and be managing building things end to end from scratch."", <br/>, <br/>, 'Location: River North, Chicago. Onsite three days a week: Monday, Tuesday, and Thursday. Remote Wednesday and Friday.', <br/>, <br/>, 'TLDR: We are looking for someone with proficiency in both backend and frontend. Our stack is python via Flask on the backend and React with Typescript to build our app and chrome extension on the frontend.', <br/>, <br/>, <strong>Company Overview<br/><br/></strong>, 'Gridlines is an early-stage venture-backed startup focused on improving productivity for financial analysts by utilizing cutting-edge technology. We are seeking a talented and versatile Full-Stack Engineer with a strong software engineering background to join our team and lead ongoing projects. We are at an exciting inflection point, and you will work directly with our Founder. This is a unique chance to be part of a dynamic startup, where your contributions will have a significant impact.', <br/>, <br/>, <strong>Backend Development<br/><br/></strong>, 'As an early-stage startup, you will have the opportunity to contribute to various aspects of our projects. Your primary focus will be on full-stack development, combining both backend and frontend responsibilities. Responsibilities include:', <br/>, <br/>, 'Design, develop, and maintain scalable and high-performance backend systems and APIs to support our computer vision applications and other product features.', <br/>, <br/>, 'Implement best practices for code quality, testing, and deployment automation to ensure efficient and reliable software delivery.', <br/>, <br/>, <strong>Frontend Development<br/><br/></strong>, 'Develop user-friendly interfaces and interactive features using modern web technologies.', <br/>, <br/>, 'Collaborate with designers to implement intuitive and visually appealing user interfaces.', <br/>, <br/>, 'Ensure responsive design and optimal performance across different devices and platforms.', <br/>, <br/>, 'Work with computer vision engineers to integrate computer vision algorithms and models into the frontend application using Python.', <br/>, <br/>, 'Collaborate on developing and optimizing computer vision pipelines and processing large datasets.', <br/>, <br/>, <strong>Database Management<br/><br/></strong>, 'Design and optimize database schemas and queries for efficient data retrieval and storage.', <br/>, <br/>, 'Work on ways to improve data management processes, including data collection, preprocessing, and storage.', <br/>, <br/>, <strong>Infrastructure Development<br/><br/></strong>, 'Contribute to the overall software architecture and infrastructure, ensuring scalability, reliability, and security.', <br/>, <br/>, 'Utilize cloud computing platforms, such as Google Cloud Platform (GCP), to deploy and manage backend services and applications.', <br/>, <br/>, <strong>Collaboration And Communication<br/><br/></strong>, 'Work closely with team members to understand project requirements, provide technical expertise, and deliver high-quality solutions.', <br/>, <br/>, 'Participate in regular team meetings and contribute to brainstorming sessions, sharing ideas, and offering constructive feedback.', <br/>, <br/>, <strong>Qualifications<br/><br/></strong>, ""Bachelor's or Master's degree in Computer Science, Software Engineering, or a related field."", <br/>, <br/>, 'Proficiency in both backend and frontend development languages, such as Python, JavaScript (React), and/or Electron.', <br/>, <br/>, 'Strong understanding of database systems, including SQL and NoSQL databases.', <br/>, <br/>, 'Knowledge of RESTful API design principles and experience building and consuming APIs.', <br/>, <br/>, 'Familiarity with software development best practices, version control systems (e.g., Git), and agile methodologies.', <br/>, <br/>, 'Solid understanding of computer vision principles, techniques, and algorithms.', <br/>, <br/>, 'Proven track record of successfully delivering full-stack projects from design to deployment.', <br/>, <br/>, 'Excellent problem-solving skills and the ability to think creatively to overcome technical challenges.', <br/>, <br/>, 'Strong communication and collaboration skills, with the ability to effectively convey complex technical concepts to both technical and non-technical stakeholders.', <br/>, <br/>, 'If you are passionate about full-stack development, combining backend, frontend, and computer vision, and want to work with cutting-edge technologies, we would love to hear from you. To apply, please submit your resume, along with a brief cover letter highlighting your relevant experience and why you are interested in joining our team.\n        ']",4+,Hybrid,Pay not stated
