l_id,company,title,location,level,posted,url,description,yoe,arrangement,pay
4138717722,Blitt & Gaines Law Offices,Software Developer,"Vernon Hills, IL",Entry level,2025-01-30 10:20:21,https://www.linkedin.com/jobs/view/software-developer-at-blitt-gaines-law-offices-4138717722?trk=public_jobs_topcard-title,"['\n', <strong>Description<br/><br/></strong>, <strong>Job Title: </strong>, 'Software Developer', <br/>, <br/>, <strong>Job Summary<br/><br/></strong>, 'As a developer, you will be working with Blitt and Gaines, P.C.’s product development team, building and testing web and mobile applications utilizing SQL, HTML5, C#, and Power BI. This role will also continually review the historical and on-going accuracy and integrity of the data and reports generated from our systems.', <br/>, <br/>, 'This is an experienced level position with opportunity for potential advancement into further development roles within the firm. You will work under the Executive Director of Operations and our senior programmers and work to build a variety of types of applications for our firm.', <br/>, <br/>, <strong>Responsibilities And Duties<br/><br/></strong>, <ul><li>The individual in this position will be expected to execute complex data queries, integrate and manipulate data from multiple sources, and apply appropriate research and statistical methods in order to produce both internal &amp; external reports.</li><li>Uses SQL to query, analyze and integrate internal, client data. </li><li>Skills with AI and Machine Learning</li><li>Develop C# .net solutions for the organization.</li><li>Critically reviews and revises existing processes and applications for updates to methodologies and program enhancements.</li><li> Identifies data, systems and operations problems and recommends solutions and changes to streamline procedures for more effective reporting. Diagnose root causes and making recommendations to management.</li><li>Performs quality assurance to evaluate data quality and integrity.</li><li>Interprets results and prepares findings for presentation to internal and external audiences.</li><li>Analyzes system technical requirements and provides appropriate input to the development or selection of solutions, taking into consideration project constraints.</li><li>Participates in the design and configuration of input forms, screen designs, tables, system outputs, and interfaces that meet the business needs of the customer.</li><li>Develops and maintains the technical skills necessary for system configuration and system administration activities. Assists team members in developing configuration skills, as needed.</li><li>Ensures that system technical design is consistent with institutional and regulatory standards.</li><li>Analyzes application needs in the department and configures current applications or develops new applications to support them. Incorporates feedback from the appropriate departmental personnel applications are configured or developed.</li><li>To Process, cleanse data and collate date, analyze that data using SQL and create reports on data using SSRS as per request from Stake holders and colleagues.</li><li>The SQL Report Writer will gain an understanding of client needs and then develop customized SSRS reports and prepare data for new implementations. </li><li>The SQL Report Writer will also be responsible for optimization and reliability while also developing stored procedures as well as other complex SQL queries.</li><li> Designing, developing, testing and implementing web-based and SQL server reporting applications that support the requirements defined by users and analysts.</li><li> Developing and performing regular data quality checking processes ensuring data from source systems is correctly flowing through to our systems.<br/><br/></li></ul>, <strong>Minimal Job Qualifications And Requirements<br/><br/></strong>, <ul><li> Bachelor’s degree in Computer Science or related field</li><li> 2 yrs minimum experience in SQL and C# is required</li><li> Experience with Power BI</li><li> Knowledge of other coding languages (Java, C+)</li><li>AI Bot Experience is a must</li><li> Building dashboards, data warehousing</li><li> Ability to write clean, easy to understand code</li><li> Strong written and oral communication skills</li><li> Analytical problem solving skills</li><li> Demonstrates the ability to think independently and use good judgment</li><li> Fundamental knowledge of Microsoft Office Products</li><li>Be open to learning and using whatever technologies are needed. We are pragmatic-as opposed to philosophical-about our tools.</li><li>Be detailed-oriented.</li><li>Be able to follow directions and adhere to established, repeatable programming patterns.<br/><br/></li></ul>, <strong>Benefits<br/><br/></strong>, 'Blitt and Gaines, P.C. offers PTO, Paid Holidays, Medical Benefits, Competitive Salary and 401k and profit sharing plans! Medical Benefits include - Medical, Dental, Vision, Life Insurance and Short Term Disability.\n        ']",2-4,On-site,Pay not stated
4138718766,Blitt & Gaines Law Offices,Software Developer,"Merrillville, IN",Entry level,2025-01-30 10:20:21,https://www.linkedin.com/jobs/view/software-developer-at-blitt-gaines-law-offices-4138718766?trk=public_jobs_topcard-title,"['\n', <strong>Description<br/><br/></strong>, <strong>Job Title: </strong>, 'Software Developer', <br/>, <br/>, <strong>Job Summary<br/><br/></strong>, 'As a developer, you will be working with Blitt and Gaines, P.C.’s product development team, building and testing web and mobile applications utilizing SQL, HTML5, C#, and Power BI. This role will also continually review the historical and on-going accuracy and integrity of the data and reports generated from our systems.', <br/>, <br/>, 'This is an experienced level position with opportunity for potential advancement into further development roles within the firm. You will work under the Executive Director of Operations and our senior programmers and work to build a variety of types of applications for our firm.', <br/>, <br/>, <strong>Responsibilities And Duties<br/><br/></strong>, <ul><li>The individual in this position will be expected to execute complex data queries, integrate and manipulate data from multiple sources, and apply appropriate research and statistical methods in order to produce both internal &amp; external reports.</li><li>Uses SQL to query, analyze and integrate internal, client data. </li><li>Skills with AI and Machine Learning</li><li>Develop C# .net solutions for the organization.</li><li>Critically reviews and revises existing processes and applications for updates to methodologies and program enhancements.</li><li> Identifies data, systems and operations problems and recommends solutions and changes to streamline procedures for more effective reporting. Diagnose root causes and making recommendations to management.</li><li>Performs quality assurance to evaluate data quality and integrity.</li><li>Interprets results and prepares findings for presentation to internal and external audiences.</li><li>Analyzes system technical requirements and provides appropriate input to the development or selection of solutions, taking into consideration project constraints.</li><li>Participates in the design and configuration of input forms, screen designs, tables, system outputs, and interfaces that meet the business needs of the customer.</li><li>Develops and maintains the technical skills necessary for system configuration and system administration activities. Assists team members in developing configuration skills, as needed.</li><li>Ensures that system technical design is consistent with institutional and regulatory standards.</li><li>Analyzes application needs in the department and configures current applications or develops new applications to support them. Incorporates feedback from the appropriate departmental personnel applications are configured or developed.</li><li>To Process, cleanse data and collate date, analyze that data using SQL and create reports on data using SSRS as per request from Stake holders and colleagues.</li><li>The SQL Report Writer will gain an understanding of client needs and then develop customized SSRS reports and prepare data for new implementations. </li><li>The SQL Report Writer will also be responsible for optimization and reliability while also developing stored procedures as well as other complex SQL queries.</li><li> Designing, developing, testing and implementing web-based and SQL server reporting applications that support the requirements defined by users and analysts.</li><li> Developing and performing regular data quality checking processes ensuring data from source systems is correctly flowing through to our systems.<br/><br/></li></ul>, <strong>Minimal Job Qualifications And Requirements<br/><br/></strong>, <ul><li> Bachelor’s degree in Computer Science or related field</li><li> 2 yrs minimum experience in SQL and C# is required</li><li> Experience with Power BI</li><li> Knowledge of other coding languages (Java, C+)</li><li>AI Bot Experience is a must</li><li> Building dashboards, data warehousing</li><li> Ability to write clean, easy to understand code</li><li> Strong written and oral communication skills</li><li> Analytical problem solving skills</li><li> Demonstrates the ability to think independently and use good judgment</li><li> Fundamental knowledge of Microsoft Office Products</li><li>Be open to learning and using whatever technologies are needed. We are pragmatic-as opposed to philosophical-about our tools.</li><li>Be detailed-oriented.</li><li>Be able to follow directions and adhere to established, repeatable programming patterns.<br/><br/></li></ul>, <strong>Benefits<br/><br/></strong>, 'Blitt and Gaines, P.C. offers PTO, Paid Holidays, Medical Benefits, Competitive Salary and 401k and profit sharing plans! Medical Benefits include - Medical, Dental, Vision, Life Insurance and Short Term Disability.\n        ']",2-4,On-site,Pay not stated
4138700996,Gridlines,Founding Software Engineer,"Chicago, IL",Mid-Senior level,2025-01-30 10:20:21,https://www.linkedin.com/jobs/view/founding-software-engineer-at-gridlines-4138700996?trk=public_jobs_topcard-title,"['\n          Job Description: Full-Stack Engineer. ', <strong>Must have 3+ years of work experience as a software engineer.<br/><br/></strong>, ""Note: We are a team of two people, you will be the third! This means you'll have a LOT of responsibility and be managing building things end to end from scratch."", <br/>, <br/>, 'Location: River North, Chicago. Onsite three days a week: Monday, Tuesday, and Thursday. Remote Wednesday and Friday.', <br/>, <br/>, 'TLDR: We are looking for someone with proficiency in both backend and frontend. Our stack is python via Flask on the backend and React with Typescript to build our app and chrome extension on the frontend.', <br/>, <br/>, <strong>Company Overview<br/><br/></strong>, 'Gridlines is an early-stage venture-backed startup focused on improving productivity for financial analysts by utilizing cutting-edge technology. We are seeking a talented and versatile Full-Stack Engineer with a strong software engineering background to join our team and lead ongoing projects. We are at an exciting inflection point, and you will work directly with our Founder. This is a unique chance to be part of a dynamic startup, where your contributions will have a significant impact.', <br/>, <br/>, <strong>Backend Development<br/><br/></strong>, 'As an early-stage startup, you will have the opportunity to contribute to various aspects of our projects. Your primary focus will be on full-stack development, combining both backend and frontend responsibilities. Responsibilities include:', <br/>, <br/>, 'Design, develop, and maintain scalable and high-performance backend systems and APIs to support our computer vision applications and other product features.', <br/>, <br/>, 'Implement best practices for code quality, testing, and deployment automation to ensure efficient and reliable software delivery.', <br/>, <br/>, <strong>Frontend Development<br/><br/></strong>, 'Develop user-friendly interfaces and interactive features using modern web technologies.', <br/>, <br/>, 'Collaborate with designers to implement intuitive and visually appealing user interfaces.', <br/>, <br/>, 'Ensure responsive design and optimal performance across different devices and platforms.', <br/>, <br/>, 'Work with computer vision engineers to integrate computer vision algorithms and models into the frontend application using Python.', <br/>, <br/>, 'Collaborate on developing and optimizing computer vision pipelines and processing large datasets.', <br/>, <br/>, <strong>Database Management<br/><br/></strong>, 'Design and optimize database schemas and queries for efficient data retrieval and storage.', <br/>, <br/>, 'Work on ways to improve data management processes, including data collection, preprocessing, and storage.', <br/>, <br/>, <strong>Infrastructure Development<br/><br/></strong>, 'Contribute to the overall software architecture and infrastructure, ensuring scalability, reliability, and security.', <br/>, <br/>, 'Utilize cloud computing platforms, such as Google Cloud Platform (GCP), to deploy and manage backend services and applications.', <br/>, <br/>, <strong>Collaboration And Communication<br/><br/></strong>, 'Work closely with team members to understand project requirements, provide technical expertise, and deliver high-quality solutions.', <br/>, <br/>, 'Participate in regular team meetings and contribute to brainstorming sessions, sharing ideas, and offering constructive feedback.', <br/>, <br/>, <strong>Qualifications<br/><br/></strong>, ""Bachelor's or Master's degree in Computer Science, Software Engineering, or a related field."", <br/>, <br/>, 'Proficiency in both backend and frontend development languages, such as Python, JavaScript (React), and/or Electron.', <br/>, <br/>, 'Strong understanding of database systems, including SQL and NoSQL databases.', <br/>, <br/>, 'Knowledge of RESTful API design principles and experience building and consuming APIs.', <br/>, <br/>, 'Familiarity with software development best practices, version control systems (e.g., Git), and agile methodologies.', <br/>, <br/>, 'Solid understanding of computer vision principles, techniques, and algorithms.', <br/>, <br/>, 'Proven track record of successfully delivering full-stack projects from design to deployment.', <br/>, <br/>, 'Excellent problem-solving skills and the ability to think creatively to overcome technical challenges.', <br/>, <br/>, 'Strong communication and collaboration skills, with the ability to effectively convey complex technical concepts to both technical and non-technical stakeholders.', <br/>, <br/>, 'If you are passionate about full-stack development, combining backend, frontend, and computer vision, and want to work with cutting-edge technologies, we would love to hear from you. To apply, please submit your resume, along with a brief cover letter highlighting your relevant experience and why you are interested in joining our team.\n        ']",4+,Hybrid,Pay not stated
4139094925,Power Nest,Back End Developer,"Chicago, IL",Associate,2025-01-30 10:20:22,https://www.linkedin.com/jobs/view/back-end-developer-at-power-nest-4139094925?trk=public_jobs_topcard-title,"['\n', <strong>Skills:<br/></strong>, 'Node.js, Python, Java, RESTful APIs, SQL, Docker, Microservices Architecture, AWS,', <br/>, <br/>, <strong>Position</strong>, ': Backend Developer (Junior Level)', <br/>, <br/>, <strong>Location</strong>, ': United States (Remote/On-site)', <br/>, <br/>, <strong>Job Type</strong>, ': Full-Time (Unpaid Role Until Fundraise)', <br/>, <br/>, <strong>About Us<br/><br/></strong>, 'Power Nest Talent, a leader in talent management and business advisory, is seeking a motivated ', <strong>Backend Developer</strong>, ' to join our team and work on a project for one of our esteemed clients. This role offers a unique opportunity to contribute to building robust and scalable backend systems in a dynamic startup environment. This is an unpaid role until our next round of fundraising, providing a chance to grow with us from the ground up.', <br/>, <br/>, <strong>Key Responsibilities<br/><br/></strong>, <ul><li>Develop and maintain server-side logic and APIs, ensuring high performance and responsiveness.</li><li>Collaborate with front-end developers to integrate user-facing elements with server-side logic.</li><li>Design and implement data storage solutions, including database schemas and relationships.</li><li>Troubleshoot, debug, and upgrade existing systems.</li><li>Optimize application performance and scalability.</li><li>Stay updated with emerging backend technologies and best practices.</li><li>Work closely with our clients team to understand their requirements and deliver effective solutions.<br/><br/></li></ul>, <strong>Qualifications<br/><br/></strong>, <ul><li>Education:</li><li>Bachelors degree in Computer Science, Software Engineering, or a related field (preferred but not mandatory).</li><li>Relevant certifications in backend development or cloud computing are a plus.</li><li>Experience:</li><li>0-2 years of experience in backend development or a related field.</li><li>Proficiency in server-side languages such as Python, Node.js, Ruby, Java, or PHP.</li><li>Experience with database management systems like MySQL, MongoDB, or PostgreSQL.</li><li>Skills:</li><li>Strong understanding of RESTful APIs and web services.</li><li>Knowledge of cloud services (AWS, Azure, or Google Cloud) is a plus.</li><li>Ability to write clean, maintainable, and efficient code.</li><li>Good problem-solving skills and attention to detail.</li><li>Strong communication skills and ability to work collaboratively in a team environment.<br/><br/></li></ul>, <strong>Salary Range<br/><br/></strong>, <ul><li>This is an unpaid role until our next round of fundraising. Upon successful fundraising, compensation will be aligned with market standards for junior-level backend developers in the US.<br/><br/></li></ul>, <strong>Why Join Us<br/><br/></strong>, <ul><li>Contribute to meaningful projects for our clients in a fast-paced startup environment.</li><li>Gain hands-on experience in backend development with cutting-edge technologies.</li><li>Opportunity for career advancement and professional development.</li><li>Be part of a supportive and innovative team committed to making an impact.<br/><br/></li></ul>, <strong>Power Nest Talent is an equal opportunity employer. We celebrate diversity and are committed to creating an inclusive environment for all team members.</strong>, '\n']",0-2,Hybrid,Pay not stated
4136811963,Staffing Matches,Front End Developer,"Chicago, IL",Entry level,2025-01-30 10:20:22,https://www.linkedin.com/jobs/view/front-end-developer-at-staffing-matches-4136811963?trk=public_jobs_topcard-title,"['\n', <p>We are looking for a hybrid Front End Developer! In this role you'll work on an ecommerce website using Javascript, Reactjs, Sling, HTML5, etc. </p>, <p><br/></p>, <p>The work you do will be focused on enhancing website functionality, creating integrations across platforms, and coordinating development activities performed by external consultants.</p>, <p><br/></p>, <p><strong>Please note sponsorship or visa transfers are not available for this role.</strong></p>, <p><br/></p>, <p><strong>Responsibilities</strong></p>, <ul><li>Oversee the development and optimization of websites.</li><li>Consolidate multiple websites into one to simplify management of websites</li><li>Collaborate with vendors, marketing, and IT teams to advance the company’s digital roadmap and strategic initiatives.</li><li>Offer technical architecture recommendations to align with business goals.</li><li>Support omni-channel marketing campaigns by building landing pages, configuring page tagging, managing web forms, and tracking leads through Salesforce.</li><li>Manage the configuration and implementation of eCommerce platforms and content management systems (CMS).</li><li>Carry out hands-on development tasks, including creating new features, enhancements, and integrations</li><li>Conduct and facilitate quality assurance (QA) and user acceptance testing (UAT).</li><li>Identify, troubleshoot, and resolve technical issues as they arise.</li></ul>, <li></li>, <p><strong>Requirements</strong></p>, <ul><li>5+ years software development</li><li>Bachelor's degree</li><li>Ability to work onsite 3+ days/week</li></ul>, '\n']",4+,Hybrid,Pay not stated
