l_id,company,title,location,level,posted,url,description
4104248976,Algo Capital Group,Full Stack Engineer,"Chicago, IL",Mid-Senior level,2025-01-29 22:14:45,https://www.linkedin.com/jobs/view/full-stack-engineer-at-algo-capital-group-4104248976?trk=public_jobs_topcard-title,"['\n', <p><strong>About Our Client:</strong></p>, <p><br/></p>, <p>A high performing proprietary trading firm is growing their rapidly evolving crypto trading team. You will be designing and implementing Java based tools as well as microservices and API Integration for a crypto desk working with state of the art technologies and the strongest engineers worldwide.</p>, <p><br/></p>, <p>This team is responsible for building, designing and developing the full stack of software, tools, and technologies for Order Management Systems (OMS) ,FIX Connectivity, and Trade Flow Analytics serving core infrastructure services using Java and some Python.</p>, <p><br/></p>, <p><strong>Core Focus Areas:</strong></p>, <ul><li>Lead development of market data processing engines and execution platforms powering 24/7 global digital asset operations</li><li>Build high-throughput order management systems (OMS), FIX connectivity layers, and real-time analytics dashboards</li><li>Develop across multiple technology stacks; Java backend systems, Python automation frameworks and TypeScript.</li><li>Drive system modernization while maintaining legacy platforms and support production systems as part of on-call rotation</li><li>Partner with front office, middle office and engineering teams to drive the production environment.</li></ul>, <p><br/></p>, <p><strong>Qualifications:</strong></p>, <ul><li>Years of experience with building enterprise Java systems</li><li>Strong experience developing automation frameworks, preferably in Python scripting</li><li>Deep understanding of market data protocols, multicast networks and websocket implementations</li><li>Experience with order processing engines and matching systems</li><li>Hands- on with Message queuing systems, Microservices architectures and RESTful API design</li><li>Trading platform experience preferably in post- trade or transactional systems</li></ul>, <p><br/></p>, <p>Excellent competitive compensation with great growth opportunities, cash bonus scheme, benefits on offer, and a business that encourages you to learn new skills and apply them to your job on a daily basis while collaborating with some of the most innovative minds in the crypto space.</p>, <p><br/></p>, <p>Apply directly or email: nsoliman@algocapitalgroup.com</p>, <p><br/></p>, <p>linkedin.com/company/algocapitalgroup - Follow Algo Capital for the latest job updates.</p>, <p></p>, '\n']"
4132868335,Algo Capital Group,Software Engineer – HFT,"Chicago, IL",Mid-Senior level,2025-01-29 22:14:46,https://www.linkedin.com/jobs/view/software-engineer-%E2%80%93-hft-at-algo-capital-group-4132868335?trk=public_jobs_topcard-title,"['\n', <p><strong><u>Software Engineer – HFT</u></strong></p>, <p>A leading global automated proprietary trading firm is seeking a Software Engineer specializing in high-frequency trading (HFT) to spearhead the development of their next generation of trading systems and operations. In this role, you will motivate and guide teams to advance algorithmic trading technologies, utilizing cutting-edge quantitative tools while collaborating with exceptional engineers, ML traders, and Quant researchers. You will also be responsible for evaluating system performance and proactively identifying opportunities for improvement to optimise efficiency and reliability.</p>, <p><br/></p>, <p><strong>Main Responsibilities</strong></p>, <ul><li>Manage Trading Systems: Oversee the development and maintenance of state-of-the-art high-frequency trading systems and applications</li><li>Collaborate Across Teams: Work closely with top-tier quantitative teams and technologists from various trading divisions to optimize trading solutions</li><li>Enhance Operations: Drive improvements in trading operations across multiple asset classes globally</li></ul>, <p><br/></p>, <p><strong>Candidate Requirements</strong></p>, <ul><li>Demonstrated experience in leading and mentoring engineering teams within a fast-paced environment</li><li>Track record of optimizing and maintaining HF trading systems</li><li>Strong programming skills in Python and C++</li><li>Solid knowledge of Linux/Unix systems for server management and deployment</li><li>Strong academic credentials in a STEM discipline, preferably in computer science or engineering</li></ul>, <p><br/></p>, <p>Apply now to join one of the top teams in algorithmic trading and financial markets, where you'll play a pivotal role in building next-generation trading systems and technologies.</p>, <p></p>, '\n']"
4138639202,Vibes,Software Engineer,"Chicago, IL",Mid-Senior level,2025-01-29 22:14:46,https://www.linkedin.com/jobs/view/software-engineer-at-vibes-4138639202?trk=public_jobs_topcard-title,"['\n', <p>Vibes helps marketing, loyalty, and customer experience professionals at the world's most respected brands unlock new revenue and better service their customers by arming them with the technology and expertise they need to succeed in digital mobile marketing &amp; engagement. The Vibes Mobile Engagement Platform enables marketers to easily manage and analyze all mobile communication channels including intelligent programmatic text messaging (SMS/MMS), push notifications, Apple Wallet, Google Wallet and mobile web campaigns — all through a single unified interface. Vibes has delivered more than ten billion mobile experiences on behalf of customers that include Polo Ralph Lauren, Chipotle, Discover, Kohl’s and Allstate. To learn more about Vibes, visit www.vibes.com.</p>, <p><br/></p>, <p><strong>Position Overview:</strong></p>, <p>We are seeking a collaborative, proactive, and results-driven full stack Software Engineer to join our dynamic and primarily remote team. In this role, you will play a crucial part in the development and maintenance of our cloud-based applications, with a focus on both backend Ruby on Rails and frontend React development. Additionally, you will be responsible for deploying and managing infrastructure using Terraform and ensuring optimal performance and scalability on AWS cloud services.</p>, <p><br/></p>, <p>An ideal candidate possesses a growth mindset, strategic thinking capacity, and strong communication skills. This role holds significant impact at Vibes during a period of exciting growth. In a world marked by constant change and uncertainty, one area that's growing rapidly is the digital consumer engagement space. Specifically, how brands establish personalized, 1-on-1 interactions with consumers at scale. This role places you at the heart of this exciting evolution in consumer engagement. If you're eager to build systems that offer large enterprises the latest innovations in mobile marketing technology and spread positive vibes, then you have an opportunity to thrive here.</p>, <p><br/></p>, <p>This is a full-time, hybrid position based in the greater Chicago metro area, reporting to the Director of Platform Engineering. In 2024, Vibes was recognized as a Built In Best Hybrid Place to Work.</p>, <p><br/></p>, <p><strong>Responsibilities:</strong></p>, <ul><li>Develop and maintain robust, scalable, and high-performance backend solutions using Ruby on Rails, incorporating serverless architecture, microservices, and BFF patterns.</li><li>Design and implement responsive frontend interfaces using React.js/Typescript ensuring a seamless user experience.</li><li>Collaborate with cross-functional teams to understand requirements, architect solutions, and deliver features within established timelines.</li><li>Deploy and manage infrastructure components on AWS cloud using Terraform, ensuring reliability, security, and scalability.</li><li>Troubleshoot and debug issues across the full stack, from frontend UI elements to backend database queries.</li><li>Generalize in technology by maintaining broad knowledge about the entire system and the technologies used.</li><li>Own systems by designing and implementing larger initiatives, owning the production operations and monitoring of the system, and being aware of its SLAs.</li><li>Proactively support other team members and help them to be successful.</li><li>Challenge team processes, looking for ways to improve them.</li><li>Create an impact on the team as a whole vs. specific parts of it.</li></ul>, <p><br/></p>, <p><strong>Requirements &amp; Qualifications:</strong></p>, <ul><li>Bachelor's degree in Computer Science, Engineering, or related field.</li><li>3+ years of professional experience as a Software Engineer, with a focus on full stack development.</li><li>Strong proficiency in backend development using Ruby on Rails, with a solid understanding of object-oriented programming principles.</li><li>Hands-on experience in frontend development using React.js, including state management with Redux or similar libraries.</li><li>Proficiency in serverless architecture, microservices, and BFF patterns.</li><li>Hands-on experience deploying and managing cloud infrastructure on AWS using Terraform or similar tools.</li><li>Familiarity with containerization technologies such as Docker and container orchestration platforms is a plus.</li><li>Passion for learning and staying updated on emerging technologies, best practices, and industry trends.</li><li>Proven track record of driving innovation and implementing cutting-edge solutions.</li><li>Dedication to delivering high-quality solutions that meet the needs of our clients and stakeholders, with a focus on usability, reliability, and scalability.</li><li>Excellent problem-solving skills and the ability to troubleshoot complex issues across the full stack.</li><li>Strong communication and collaboration skills, with the ability to work effectively in a fast-paced, team-oriented environment.</li><li>Ability and willingness to travel to Vibes' downtown Chicago, IL, office several times a month.</li><li>Authorized to work in the United States without the need for current or future employer sponsorship.</li></ul>, <p><br/></p>, <p><strong>Our Core Values:</strong></p>, <ul><li>Respect, Honesty, and Integrity for All Stakeholders</li><li>Always be Learning</li><li>Relentless Focus on the Customer</li><li>Never be Satisfied</li><li>Create Value</li><li>Seek Accountability and Ownership</li></ul>, <p><br/></p>, <p><strong><u>Compensation and Benefits</u></strong></p>, <p>The compensation range for this role is $95,000 to $115,000. Final compensation will be determined by factors such as relevant work experience, skills, and certifications. Vibes offers a full slate of benefits from competitive salaries, options, medical, dental and vision coverage, short- and long-term disability, life insurance, 12 paid holidays, flexible vacation, summer Fridays, Winter Holiday break, commuter benefits, a 401(k) plan and match, and a paid parental leave program.</p>, <p><br/></p>, <p><strong><u>Equal Opportunity</u></strong></p>, <p>Vibes is proud to be an Equal Opportunity Employer and provides equal employment opportunities to all employees and applicants regardless of race, color, religion, gender, gender identity, age, national origin, disability, parental or pregnancy status, marriage and civil partnership, sexual orientation, veteran status, or any other characteristic protected by law. Reasonable accommodations will be made to meet the requirements of the Americans with Disabilities Act and will be provided as requested by candidates taking part in all aspects of the selection process.</p>, '\n']"
4138263281,Walter P Moore,Front-end Software Developer,"Chicago, IL",Entry level,2025-01-29 22:14:46,https://www.linkedin.com/jobs/view/front-end-software-developer-at-walter-p-moore-4138263281?trk=public_jobs_topcard-title,"['\n', <strong>Responsibilities<br/><br/></strong>, 'We are looking for a motivated, adaptable, proficient front-end developer. Someone who can understand the product goals, has the appetite for experimentation, who loves to learn new technologies and will take the initiative to propose and create appropriate solutions/options for changing situations.', <br/>, <br/>, 'The ideal candidate would have experience with React and be able to work as a front-end developer on a larger team or have a broader experience in either UI/UX and/or database/API integration. Our team is responsible for developing and designing front-end web solutions to support the building design lifecycle.', <br/>, <br/>, 'We are looking for candidates who are ready to roll up their sleeves and get work done!', <br/>, <br/>, 'The Type of Person That Will Excel:', <br/>, <br/>, <ul><li> You are curious, inquisitive, and have demonstrated a constant eagerness to learn through actions </li><li> Excellent communications skills </li><li> You have a “can-do” attitude and are willing to go beyond the basic requirements of the position </li><li> You demonstrate personal accountability and integrity in all actions <br/><br/></li></ul>, <strong> Key Responsibilities: <br/><br/></strong>, <ul><li> Gather requirements from stakeholders and work collaboratively within a team as well as independently on assigned projects </li><li> Develop responsive and user-friendly web interfaces using React, HTML and CSS. </li><li> Integrate front-end and back-end components to create seamless, end-to-end web applications. </li><li> Build and own quality throughout the development cycle by writing automated unit tests, integration tests, functional tests, and UI tests </li><li> Iteratively build application features to allow users to compare interactions with multiple options. </li><li> Implement completely new features from scratch and work through integration of those features with the rest of the codebase. </li><li> Constantly learning innovative technologies and new ways of approaching a problem <br/><br/></li></ul>, <strong>Qualifications<br/><br/></strong>, <ul><li> Bachelor’s degree in computer science or related work experience </li><li> Strong in JavaScript (ES6), HTML, and CSS </li><li> Strong Web UI framework experience (React, Next JS, etc …) </li><li> Able to implement completely new features from scratch and work through integration of those features with the rest of the codebase. </li><li> Can write code that is ES Lint-compliant and cross-browser compatible </li><li> High level of proficiency in Git </li><li> Strong communication , customer service, troubleshooting, organizational skills, work prioritization, self-direction, and the ability to complete assigned work. </li><li> Excellent English fluency, both spoken and written. </li><li> Ability to work from your home without disruptions <br/><br/></li></ul>, <strong> Desi red, but not Required: <br/><br/></strong>, <ul><li> Three.JS or React Three Fiber/Drei </li><li> Continuous Integration experience </li><li> E xperience with SharePoint framework, MongoDB or SQL </li><li> Prototyping experience: Adobe XD/Figma (with examples) </li><li> Experience with Azure DevOps, release pipelines, application insights, blob storage. </li><li> Experience extending Flask APIs with Python </li><li> Some graphic design experience (e.g., Adobe InDesign, Illustrator, and Photoshop; and Microsoft PowerPoint) </li><li> Experience with one or more test automation frameworks <br/><br/></li></ul>, <strong> Hybrid Firm Po sition : <br/><br/></strong>, 'As a Hybrid Firm, Walter P Moore combines the best of both worlds – blending work options to include in-office and home office environments . This allows us to offer more flexibility and work-life integration to our employees . Candidates applying for this position should have the ability to commute to or periodically travel to the affiliated office.', <br/>, <br/>, 'To ensure the ability to setup a suitable home office space, Walter P Moore offers a one-time $1,000 stipend that would be paid upon completion of the first week of employment. An additional $50 monthly stipend will also be provided to cover ongoing home office expenses .', <br/>, <br/>, <strong>Overview<br/><br/></strong>, 'Walter P Moore is an international company of consultants, architects, engineers, innovators, and creative people who solve some of the world’s most complex structural and infrastructural challenges. Providing structural, diagnostics, civil, water resources, traffic, transportation engineering, parking and technology consulting services, we develop solutions that are cost- and resource-efficient, forward-thinking, and help support and shape our communities. Founded in 1931, we are headquartered in Houston, Texas and have more than 800 professionals working across 24 U.S. offices and 7 international locations.\n        ']"
4138156975,Devfi,Python Developer,"Chicago, IL",Mid-Senior level,2025-01-29 22:14:47,https://www.linkedin.com/jobs/view/python-developer-at-devfi-4138156975?trk=public_jobs_topcard-title,"['\n', <p><strong><u>100% Day 1 Onsite !! </u></strong></p>, <p><strong><u> </u></strong></p>, <p><strong>Locals OR Nearby only!!</strong></p>, <p><strong><u> </u></strong></p>, <p><br/></p>, <p><strong><u>Project Duration</u></strong></p>, <p><strong>Contract, Longterm</strong></p>, <p><br/></p>, <p><br/></p>, <p><br/></p>, <p><strong><u>Job Details</u></strong></p>, <p><br/></p>, <p><strong>Role : AWS Python Developer</strong></p>, <p><strong>Location : Chicago, IL (100 % day 1 onsite)</strong></p>, <p><strong>Hire type : Contract</strong></p>, <p><br/></p>, <p><strong>Need 12+ Years</strong></p>, <p><strong> </strong></p>, <p><strong>Job Description:</strong></p>, <p><br/></p>, <p><strong>Primary Skills:</strong></p>, <p><br/></p>, <p><strong><u>Programming Languages:</u></strong></p>, <ul><li>Proficiency in Python</li><li>Experience with tool development and integration using Python</li></ul>, <p><br/></p>, <p><strong><u>AWS:</u></strong></p>, <ul><li>Mandatory experience with AWS services and architecture</li><li>Familiarity with deploying and managing applications on AWS platforms</li></ul>, <p><br/></p>, <p><strong><u>GitHub Integration:</u></strong></p>, <ul><li>Experience with integrating tools and applications with GitHub</li><li>Understanding of GitHub APIs and workflows</li></ul>, <p><strong> </strong></p>, <p><strong>Secondary Skills:</strong></p>, <p><br/></p>, <p><strong><u>Web Development:</u></strong></p>, <ul><li>Familiarity with web frameworks and development practices in Python</li><li>Knowledge of API development and RESTful services</li></ul>, <p><strong> </strong></p>, <p><strong><u>Testing and Debugging:</u></strong></p>, <ul><li>Strong debugging and troubleshooting skills</li><li>Experience with unit testing and test automation</li></ul>, <p><br/></p>, <p><strong><u>DevOps and Unix:</u></strong></p>, <ul><li>Exposure to DevOps practices and tools (Good to have)</li><li>Experience with Unix command line (Good to have)</li></ul>, <p><br/></p>, <p><strong><u>Roles and Responsibilities:</u></strong></p>, <ul><li>Develop and maintain tools and applications using Python</li><li>Integrate tools and applications with GitHub for seamless workflows</li><li>Write clean, efficient, and maintainable code</li><li>Debug and troubleshoot issues in the developed applications</li><li>Collaborate with cross-functional teams to deliver high-quality software</li><li>Leverage AWS services to build and deploy scalable and secure applications</li></ul>, <p><br/></p>, <p><br/></p>, <p><strong>Regards!</strong></p>, <p><strong>Raju Chidurala </strong></p>, <p><strong>216-343-3435</strong></p>, '\n']"
